title,url,snippet,source,search_query,search_timestamp
74 Types ofPalmTrees with Pictures: Identification Guide,https://www.bing.com/ck/a?!&&p=fa74f58dc500171a1f6aa5bb2f87cf37481f871f9e069021aaba8bda26e1c23cJmltdHM9MTc2MDgzMjAwMA&ptn=3&ver=2&hsh=4&fclid=16511d7b-5c5d-6902-36d6-0bf15d576874&u=a1aHR0cHM6Ly9sZWFmeXBsYWNlLmNvbS90eXBlcy1vZi1wYWxtLXRyZWVzLw&ntb=1,"Nov 2, 2023· This guide will help you identify and choose the perfect palm for your garden or indoor space. Discover a wide range of palms, along with their pictures.",Bing,Palm Beach Gardens non-denominational church trained staff,2025-10-19T12:55:22.060866
Get started with live streaming - Computer - YouTube Help,https://www.bing.com/ck/a?!&&p=e8183570f7a3bbbb3bbf99136e6d8f5949a87d666a4b43757b60a507d82656a8JmltdHM9MTc2MDgzMjAwMA&ptn=3&ver=2&hsh=4&fclid=16511d7b-5c5d-6902-36d6-0bf15d576874&u=a1aHR0cHM6Ly9zdXBwb3J0Lmdvb2dsZS5jb20veW91dHViZS9hbnN3ZXIvMjQ3NDAyNj9obD1lbi1FTiZjbz1HRU5JRS5QbGF0Zm9ybSUzRERlc2t0b3A&ntb=1,"Live streaming lets you interact with your audience in real time with a video feed, chat, and more.",Bing,streaming service lutheran church Deerfield Beach,2025-10-19T12:55:38.966922
Streaming Help - Google Help,https://www.bing.com/ck/a?!&&p=adf07f1a89868af3be626a6ef84feeb45a04b071937b99f61d00630adf32956cJmltdHM9MTc2MDgzMjAwMA&ptn=3&ver=2&hsh=4&fclid=16511d7b-5c5d-6902-36d6-0bf15d576874&u=a1aHR0cHM6Ly93d3cuc3VwcG9ydC5nb29nbGUuY29tL2Nocm9tZWNhc3QvY2hyb21lY2FzdC8_aGw9ZW4&ntb=1,Official Streaming Help Center where you can find tips and tutorials on using Streaming and other answers to frequently asked questions.,Bing,streaming service lutheran church Deerfield Beach,2025-10-19T12:55:38.966930
Aide Streaming - Google Help,https://www.bing.com/ck/a?!&&p=57ff540830ac58c8d6997716505ba7693b97ca41486ebef1f6b477594ac55f7aJmltdHM9MTc2MDgzMjAwMA&ptn=3&ver=2&hsh=4&fclid=16511d7b-5c5d-6902-36d6-0bf15d576874&u=a1aHR0cHM6Ly9zdXBwb3J0Lmdvb2dsZS5jb20vY2hyb21lY2FzdC9jaHJvbWVjYXN0Lz9obD1mcg&ntb=1,"Centre d'aide officiel de Streaming où vous trouverez des conseils et des didacticiels sur l'utilisation du produit, ainsi que les réponses aux questions fréquentes.",Bing,streaming service lutheran church Deerfield Beach,2025-10-19T12:55:38.966933
Meet Chromecast with Google TV - Streaming Help,https://www.bing.com/ck/a?!&&p=d92f30346ddac902398d57b4f0dc217ccd8c9e7478d4cc6496bd5cb918b47abcJmltdHM9MTc2MDgzMjAwMA&ptn=3&ver=2&hsh=4&fclid=16511d7b-5c5d-6902-36d6-0bf15d576874&u=a1aHR0cHM6Ly9zdXBwb3J0Lmdvb2dsZS5jb20vY2hyb21lY2FzdC9hbnN3ZXIvMTI1Nzg4MTg_aGw9ZW4&ntb=1,"Chromecast with Google TV brings you entertainment from many popular services, including live TV, movies, and music. Find personal recommendations based on your subscriptions, viewing …",Bing,streaming service lutheran church Deerfield Beach,2025-10-19T12:55:38.966935
Streaming說明 - Google Help,https://www.bing.com/ck/a?!&&p=31587cfe289d9a53922c2815a04241fc4a64341a7fe46ce242f93b678dad59a7JmltdHM9MTc2MDgzMjAwMA&ptn=3&ver=2&hsh=4&fclid=16511d7b-5c5d-6902-36d6-0bf15d576874&u=a1aHR0cHM6Ly9zdXBwb3J0Lmdvb2dsZS5jb20vY2hyb21lY2FzdC9nb29nbGV0dnN0cmVhbWVyP2hsPXpoLUhhbnQ&ntb=1,您可以在「Streaming 官方說明中心」找到本產品的使用教學和提示，以及各種常見問題解答。,Bing,streaming service lutheran church Deerfield Beach,2025-10-19T12:55:38.966937
Ayuda de Streaming - Google Help,https://www.bing.com/ck/a?!&&p=92548a9ef6fd05abf85ffcd498f131da899eea3c3020d51dec0c35752603f55dJmltdHM9MTc2MDgzMjAwMA&ptn=3&ver=2&hsh=4&fclid=16511d7b-5c5d-6902-36d6-0bf15d576874&u=a1aHR0cHM6Ly9zdXBwb3J0Lmdvb2dsZS5jb20vY2hyb21lY2FzdC9nb29nbGV0dnN0cmVhbWVyP2hsPWVz&ntb=1,Centro de asistencia oficial de Streaming donde puedes encontrar sugerencias y tutoriales para aprender a utilizar el producto y respuestas a otras preguntas frecuentes,Bing,streaming service lutheran church Deerfield Beach,2025-10-19T12:55:38.966939
Découvrir le Google TV Streamer (4K) - Aide Streaming,https://www.bing.com/ck/a?!&&p=86d3a58e1785ce453bbe0413209a45172d6f8ed56db4d2d0fedc0c8e923c5b4fJmltdHM9MTc2MDgzMjAwMA&ptn=3&ver=2&hsh=4&fclid=16511d7b-5c5d-6902-36d6-0bf15d576874&u=a1aHR0cHM6Ly9zdXBwb3J0Lmdvb2dsZS5jb20vY2hyb21lY2FzdC9hbnN3ZXIvMTUyNzM2NzY_aGw9ZnI&ntb=1,"Découvrir le Google TV Streamer (4K) Grâce au Google TV Streamer (4K), accédez aux divertissements proposés par des services de streaming populaires, comme la télévision en …",Bing,streaming service lutheran church Deerfield Beach,2025-10-19T12:55:38.966941
Google TV Streamer (4K) und Sprachfernbedienung einrichten,https://www.bing.com/ck/a?!&&p=26cdfaa095cecf67380917ab54b65d996e07aa27f5963f95b1d0903527ca7de9JmltdHM9MTc2MDgzMjAwMA&ptn=3&ver=2&hsh=4&fclid=16511d7b-5c5d-6902-36d6-0bf15d576874&u=a1aHR0cHM6Ly9zdXBwb3J0Lmdvb2dsZS5jb20vY2hyb21lY2FzdC9hbnN3ZXIvMTUxNTc3NjI_aGw9ZGU&ntb=1,"Google TV Streamer (4K) einrichten Es gibt zwei Möglichkeiten, den Google TV Streamer (4K) und die Google TV Streamer-Sprachfernbedienung einzurichten:",Bing,streaming service lutheran church Deerfield Beach,2025-10-19T12:55:38.966943
Google TV Help,https://www.bing.com/ck/a?!&&p=d6a1a28a31f58ab2823196f2837e7e8ad748e7d53b5e792ccc64a3c46ca071acJmltdHM9MTc2MDgzMjAwMA&ptn=3&ver=2&hsh=4&fclid=16511d7b-5c5d-6902-36d6-0bf15d576874&u=a1aHR0cHM6Ly9zdXBwb3J0Lmdvb2dsZS5jb20vZ29vZ2xldHYvZ29vZ2xldHY_aGw9ZW4&ntb=1,Official Google TV Help Center where you can find tips and tutorials on using Google TV and other answers to frequently asked questions.,Bing,streaming service lutheran church Deerfield Beach,2025-10-19T12:55:38.966945
Create a YouTube live stream with an encoder - YouTube Help,https://www.bing.com/ck/a?!&&p=34ae56b0831530c4f2ca88e99474a2c00a67ba19ec34dfc7c4121f4f57515292JmltdHM9MTc2MDgzMjAwMA&ptn=3&ver=2&hsh=4&fclid=16511d7b-5c5d-6902-36d6-0bf15d576874&u=a1aHR0cHM6Ly9zdXBwb3J0Lmdvb2dsZS5jb20veW91dHViZS9hbnN3ZXIvMjkwNzg4Mz9obD1lbg&ntb=1,"Learn how to set up a YouTube live stream using an encoder. Using an encoder, you can broadcast your gameplay, use external cameras and mics, and more.",Bing,streaming service lutheran church Deerfield Beach,2025-10-19T12:55:38.966948
Seventh - Sistemas utilizados pelos gigantes do mercado,https://www.bing.com/ck/a?!&&p=bcc615cd50ffcd93df8e56b063bd4dba32ea6a14eb471d7c5c67f7dcd973e111JmltdHM9MTc2MDgzMjAwMA&ptn=3&ver=2&hsh=4&fclid=16511d7b-5c5d-6902-36d6-0bf15d576874&u=a1aHR0cHM6Ly93d3cuc2V2ZW50aC5jb20uYnIv&ntb=1,"A Seventh é uma empresa de tecnologia, que desenvolve um time de soluções para as áreas de videomonitoramento, controle de acesso, portaria remota e gerenciamento de eventos.",Bing,seventh-day adventist autism Miami,2025-10-19T12:55:58.125018
Situator - Seventh,https://www.bing.com/ck/a?!&&p=a2e526a44017ece90b3aa9969c6053b8e95b0891a83b6fcc6fb55e4907ecac6fJmltdHM9MTc2MDgzMjAwMA&ptn=3&ver=2&hsh=4&fclid=16511d7b-5c5d-6902-36d6-0bf15d576874&u=a1aHR0cHM6Ly9ub3ZpZGFkZXMuc2V2ZW50aC5jb20uYnIvc2l0dWF0b3I&ntb=1,"Para gestão de eventos de exceção de imagem, alarme, automação, t﻿elefonia e controle de acesso, a Seventh tem o Situator. É uma plataforma PSIM para gerenciar as entradas e saídas de …",Bing,seventh-day adventist autism Miami,2025-10-19T12:55:58.125026
Seventh - Sistemas utilizados pelos gigantes do mercado,https://www.bing.com/ck/a?!&&p=ec8f736c5fb6af18ab40910f7487b006600ec1468988dd2397c5ee9707f48e9fJmltdHM9MTc2MDgzMjAwMA&ptn=3&ver=2&hsh=4&fclid=16511d7b-5c5d-6902-36d6-0bf15d576874&u=a1aHR0cHM6Ly93d3cuc2V2ZW50aC5jb20uYnIvc3Vwb3J0ZQ&ntb=1,Calculadora de Projetos Simule seu projeto de monitoramento com a calculadora da Seventh.,Bing,seventh-day adventist autism Miami,2025-10-19T12:55:58.125028
D-Guard - Seventh,https://www.bing.com/ck/a?!&&p=e2cd82be65d72f478d3a9c8b008413ec4947a94aea0417bc1bd682b982627a9dJmltdHM9MTc2MDgzMjAwMA&ptn=3&ver=2&hsh=4&fclid=16511d7b-5c5d-6902-36d6-0bf15d576874&u=a1aHR0cHM6Ly9ub3ZpZGFkZXMuc2V2ZW50aC5jb20uYnIvZC1ndWFyZA&ntb=1,"Para a sua operação de videomonitoramento, a Seventh tem o D-Guard. É um VMS que centraliza e gerencia as imagens das câmeras de segurança, seja local ou remotamente. A solução tem …",Bing,seventh-day adventist autism Miami,2025-10-19T12:55:58.125030
Seventh - Sistemas utilizados pelos gigantes do mercado,https://www.bing.com/ck/a?!&&p=a53789d0348109e641f7263bbf9bb77926f63372b64b7dcae6a969106592851eJmltdHM9MTc2MDgzMjAwMA&ptn=3&ver=2&hsh=4&fclid=16511d7b-5c5d-6902-36d6-0bf15d576874&u=a1aHR0cHM6Ly93d3cuc2V2ZW50aC5jb20uYnIvc29sdWNvZXMvY2VudHJhaXMtZGUtbW9uaXRvcmFtZW50by9jb250cm9sZS1kZS1hY2Vzc28&ntb=1,"A chave virtual Seventh é um aplicativo desenvolvido para os smartphones Android e iOS, que permite o acesso por um período de visitantes de um condomínio ou empresa mediante um …",Bing,seventh-day adventist autism Miami,2025-10-19T12:55:58.125033
Seventh - Sistemas utilizados pelos gigantes do mercado,https://www.bing.com/ck/a?!&&p=7534c78053e8fa403c62989eda7606a2ea45acb6f2db7c02de6c4305abc2f5e5JmltdHM9MTc2MDgzMjAwMA&ptn=3&ver=2&hsh=4&fclid=16511d7b-5c5d-6902-36d6-0bf15d576874&u=a1aHR0cHM6Ly93d3cuc2V2ZW50aC5jb20uYnIvc3Vwb3J0ZS9kb3dubG9hZHM&ntb=1,D-Guard Data de atualização: 05/12/2024 D-Guard v.7.2.4.5 Saiba mais Download https://www.seventh.com.br/sobre/conteudos/61454 Data de atualização: 23/04/2024 Manual D …,Bing,seventh-day adventist autism Miami,2025-10-19T12:55:58.125040
Seventh - Sistemas utilizados pelos gigantes do mercado,https://www.bing.com/ck/a?!&&p=04990ff6d03b4914224265a2a49bd2146cadd79eb48aadab1959009e1362255dJmltdHM9MTc2MDgzMjAwMA&ptn=3&ver=2&hsh=4&fclid=16511d7b-5c5d-6902-36d6-0bf15d576874&u=a1aHR0cHM6Ly93d3cuc2V2ZW50aC5jb20uYnIvc3Vwb3J0ZS9jYWxjdWxhZG9yYQ&ntb=1,The Seventh Ltda. Project Calculator is provided only as a guide. The estimations and recommendations produced by the calculator came from limited numbers of test scripts and …,Bing,seventh-day adventist autism Miami,2025-10-19T12:55:58.125042
Seventh - Sistemas utilizados pelos gigantes do mercado,https://www.bing.com/ck/a?!&&p=6f65bdde890ced3e48684e742f529dbefa04a7612e5e7462b83a20a1987d556aJmltdHM9MTc2MDgzMjAwMA&ptn=3&ver=2&hsh=4&fclid=16511d7b-5c5d-6902-36d6-0bf15d576874&u=a1aHR0cHM6Ly93d3cuc2V2ZW50aC5jb20uYnIvY29udGF0bw&ntb=1,Aceito receber notícias e novidades da Seventh. Concordo com os termos da nossa Política de Privacidade,Bing,seventh-day adventist autism Miami,2025-10-19T12:55:58.125043
Seventh - Sistemas utilizados pelos gigantes do mercado,https://www.bing.com/ck/a?!&&p=2e44cad93e193eebaa4264fe447f12f2fc8e90e3a511ab1a93673ea8bd990771JmltdHM9MTc2MDgzMjAwMA&ptn=3&ver=2&hsh=4&fclid=16511d7b-5c5d-6902-36d6-0bf15d576874&u=a1aHR0cHM6Ly93d3cuc2V2ZW50aC5jb20uYnIvc3Vwb3J0ZS9kaXNwb3NpdGl2b3MtaW50ZWdyYWRvcw&ntb=1,"Academy Certificações EAD Matriz Florianópolis, SC SEVENTH LTDA - CNPJ: 04.374.350/0001-79 Rodovia SC-401, 8.600, Sala 101, Bloco 04, Corporate Park Santo Antônio de Lisboa, CEP. …",Bing,seventh-day adventist autism Miami,2025-10-19T12:55:58.125045
D-Guard Cloud: aumente seu ticket médio e amplie a carteira,https://www.bing.com/ck/a?!&&p=23ebf92e1614afb5bd9a8ee9dd142d46173d83053b35ecffc00dbcab5b90939fJmltdHM9MTc2MDgzMjAwMA&ptn=3&ver=2&hsh=4&fclid=16511d7b-5c5d-6902-36d6-0bf15d576874&u=a1aHR0cHM6Ly9ub3ZpZGFkZXMuc2V2ZW50aC5jb20uYnIvZC1ndWFyZC1jbG91ZA&ntb=1,"Fundada em 2001, a Seventh é uma empresa do Grupo Intelbras que desenvolve softwares e aplicativos voltados para a segurança eletrônica. As plataformas ajudam mais de 1.000 centrais …",Bing,seventh-day adventist autism Miami,2025-10-19T12:55:58.125047
Home | Boynton,https://www.bing.com/ck/a?!&&p=4c8cc800d3611c8ca52ee5f5a4859939ecc9f686a02b97af90b6ceb4f571686bJmltdHM9MTc2MDgzMjAwMA&ptn=3&ver=2&hsh=4&fclid=16511d7b-5c5d-6902-36d6-0bf15d576874&u=a1aHR0cHM6Ly9ib3ludG9uLnVtbi5lZHUv&ntb=1,"Boynton Health serves students, faculty and staff of the University of Minnesota Twin Cities, providing comprehensive health care with a public health approach to campus well-being.",Bing,Boynton Beach churches dimmed lights,2025-10-19T12:57:07.157907
Make an Appointment | Boynton,https://www.bing.com/ck/a?!&&p=c004eced417d4cd01d6c9b78548478feb3e786477ec0f3e234210bc6425b2f24JmltdHM9MTc2MDgzMjAwMA&ptn=3&ver=2&hsh=4&fclid=16511d7b-5c5d-6902-36d6-0bf15d576874&u=a1aHR0cHM6Ly9ib3ludG9uLnVtbi5lZHUvbWFrZS1hcHBvaW50bWVudA&ntb=1,"It’s easy to set up an appointment at Boynton Health. You can schedule most types of appointments through the MyBoynton patient portal, or call to schedule by phone.",Bing,Boynton Beach churches dimmed lights,2025-10-19T12:57:07.157915
Boynton Mental Health & Counseling,https://www.bing.com/ck/a?!&&p=2ebaba2f09a52a0ae7672f74d3a0f716b276cd5f60e5382db342e6cfe1f04e5aJmltdHM9MTc2MDgzMjAwMA&ptn=3&ver=2&hsh=4&fclid=16511d7b-5c5d-6902-36d6-0bf15d576874&u=a1aHR0cHM6Ly9ib3ludG9uLnVtbi5lZHUvbWVudGFsLWhlYWx0aA&ntb=1,Boynton Health offers group sessions for increased support in moving toward healing or change around specific challenges. Group offerings are open to all degree-seeking students currently …,Bing,Boynton Beach churches dimmed lights,2025-10-19T12:57:07.157918
Log in | Boynton,https://www.bing.com/ck/a?!&&p=f9cef5f1a29b17b2fb598748b418c22a8496ca052d47964ff5462c8336e2b442JmltdHM9MTc2MDgzMjAwMA&ptn=3&ver=2&hsh=4&fclid=16511d7b-5c5d-6902-36d6-0bf15d576874&u=a1aHR0cHM6Ly9ib3ludG9uLnVtbi5lZHUvdXNlci9sb2dpbg&ntb=1,"Boynton Health serves students, faculty and staff of the University of Minnesota Twin Cities, providing comprehensive health care with a public health approach to campus well-being.",Bing,Boynton Beach churches dimmed lights,2025-10-19T12:57:07.157921
Get Care Now | Boynton,https://www.bing.com/ck/a?!&&p=d5af8dceedeb58988f1fb657bba821b46b8bb6bf2d508405160a42c142e7764dJmltdHM9MTc2MDgzMjAwMA&ptn=3&ver=2&hsh=4&fclid=16511d7b-5c5d-6902-36d6-0bf15d576874&u=a1aHR0cHM6Ly9ib3ludG9uLnVtbi5lZHUvZ2V0LWNhcmUtbm93&ntb=1,"Boynton Health Gopher Quick Clinic offers convenient care for minor illnesses. The clinic is open to University students, staff, and faculty. Visits are available on a first-come, first-served basis. …",Bing,Boynton Beach churches dimmed lights,2025-10-19T12:57:07.157923
Get Vaccinated | Boynton,https://www.bing.com/ck/a?!&&p=7a73665a650befaaa8a15a6dabae15f567b9f43e4d4806ec1dec8ff7d6770a36JmltdHM9MTc2MDgzMjAwMA&ptn=3&ver=2&hsh=4&fclid=16511d7b-5c5d-6902-36d6-0bf15d576874&u=a1aHR0cHM6Ly9ib3ludG9uLnVtbi5lZHUvaW1tdW5pemF0aW9uLXZhY2NpbmVz&ntb=1,"Oct 6, 2025· Boynton Health offers vaccinations through the drop-in vaccine clinic, vaccine clinic appointments, primary care appointments, the Travel Clinic, and campus vaccine clinics.",Bing,Boynton Beach churches dimmed lights,2025-10-19T12:57:07.157925
New Student Guide | Boynton,https://www.bing.com/ck/a?!&&p=193b29881e9c21aa51558bd6e123e50ccc06cf4b29d1af61191fa68817d1e40fJmltdHM9MTc2MDgzMjAwMA&ptn=3&ver=2&hsh=4&fclid=16511d7b-5c5d-6902-36d6-0bf15d576874&u=a1aHR0cHM6Ly9ib3ludG9uLnVtbi5lZHUvbmV3LXN0dWRlbnQtZ3VpZGU&ntb=1,"Boynton Health’s PAWS (Pet Away Worry and Stress) allows students to de-stress by interacting with animals right here on campus! PAWS has cats, dogs, chickens, and even miniature horses …",Bing,Boynton Beach churches dimmed lights,2025-10-19T12:57:07.157927
Pet Away Worry & Stress (PAWS) | Boynton,https://www.bing.com/ck/a?!&&p=17ebe7f9145060296918cbc4ec7a977af9945692b63c61e43e3542fbee33061fJmltdHM9MTc2MDgzMjAwMA&ptn=3&ver=2&hsh=4&fclid=16511d7b-5c5d-6902-36d6-0bf15d576874&u=a1aHR0cHM6Ly9ib3ludG9uLnVtbi5lZHUvcGV0LWF3YXktd29ycnktc3RyZXNzLXBhd3M&ntb=1,"Boynton Health’s PAWS program provides Animal-Assisted Interactions (AAI) with registered therapy animals such as dogs, cats, rabbits, and chickens. These two-hour sessions run Monday …",Bing,Boynton Beach churches dimmed lights,2025-10-19T12:57:07.157929
"Mission, Vision, and Values | Boynton",https://www.bing.com/ck/a?!&&p=b43a973deeeb7e843d49c9d7609cdc3efe6215a5baed26b9e7598d5f7f883c68JmltdHM9MTc2MDgzMjAwMA&ptn=3&ver=2&hsh=4&fclid=16511d7b-5c5d-6902-36d6-0bf15d576874&u=a1aHR0cHM6Ly9ib3ludG9uLnVtbi5lZHUvbWlzc2lvbi12aXNpb24tdmFsdWVz&ntb=1,"Boynton Health serves University of Minnesota Twin Cities students, staff and faculty. We provide comprehensive health care with a public health approach to campus wellbeing.",Bing,Boynton Beach churches dimmed lights,2025-10-19T12:57:07.157932
Health Insurance | Boynton,https://www.bing.com/ck/a?!&&p=02ef7c5a2657d7e16e379701fe562151ab1a7a88ed8fbc3f27810604cf84e069JmltdHM9MTc2MDgzMjAwMA&ptn=3&ver=2&hsh=4&fclid=16511d7b-5c5d-6902-36d6-0bf15d576874&u=a1aHR0cHM6Ly9ib3ludG9uLnVtbi5lZHUvaGVhbHRoLWluc3VyYW5jZQ&ntb=1,"UPlan members may be able to choose Boynton as their primary care clinic. Our Gopher Quick Clinic is open to most UPlan members with copayment, consult your insurance card for details.",Bing,Boynton Beach churches dimmed lights,2025-10-19T12:57:07.157934
What are corals? - ICRI,https://www.bing.com/ck/a?!&&p=e9c98fa462b810b316cc0f248a85907bf969e4c3d58d3aba7d6adb632b5dbf1bJmltdHM9MTc2MDgzMjAwMA&ptn=3&ver=2&hsh=4&fclid=16511d7b-5c5d-6902-36d6-0bf15d576874&u=a1aHR0cHM6Ly9pY3JpZm9ydW0ub3JnL2Fib3V0LWNvcmFsLXJlZWZzL3doYXQtYXJlLWNvcmFscy8&ntb=1,"Coral reefs are the largest living structure on the planet, and the only living structure to be visible from space. As we currently know them, coral reefs have evolved on earth over the past 200 to …",Bing,Coral Springs lutheran church adapted sensory friendly,2025-10-19T12:57:21.063986
84% of the world’s coral reefs impacted in the most intense global ...,https://www.bing.com/ck/a?!&&p=a8a273c5435f578fe2b96ac115d0820c5ea5a49fd5d3c7801add549ae3bb027dJmltdHM9MTc2MDgzMjAwMA&ptn=3&ver=2&hsh=4&fclid=16511d7b-5c5d-6902-36d6-0bf15d576874&u=a1aHR0cHM6Ly9pY3JpZm9ydW0ub3JnLzRnYmUtMjAyNS8&ntb=1,"Apr 23, 2025· New 5-km Coral Bleaching Products - Higher spatial resolution is the improvement to NOAA Coral Reef Watch remote-sensing products most requested by coral reef ecosystem …",Bing,Coral Springs lutheran church adapted sensory friendly,2025-10-19T12:57:21.063993
THE REPUBLIC OF THE PHILIPPINES - International Coral Reef …,https://www.bing.com/ck/a?!&&p=6d3eebd1e10a3a8ded953b212b635ea4523b827e6990aec6fe3a2aa30e3d7d0aJmltdHM9MTc2MDgzMjAwMA&ptn=3&ver=2&hsh=4&fclid=16511d7b-5c5d-6902-36d6-0bf15d576874&u=a1aHR0cHM6Ly9pY3JpZm9ydW0ub3JnL3dwLWNvbnRlbnQvdXBsb2Fkcy8yMDI0LzAzL0lDUklfTkJTQVBfQ2FzZV9TdHVkeV9QaGlsaXBwaW5lc19WMi5wZGY&ntb=1,The Philippines has extensive and diverse coastal and nearshore habitats that support an extremely high diversity of species and an estimated 25% of the country’s fisheries production5. Its coral …,Bing,Coral Springs lutheran church adapted sensory friendly,2025-10-19T12:57:21.063996
Pacific Coral Reefs at a Crossroads: New Report Calls for Urgent …,https://www.bing.com/ck/a?!&&p=6e8d9c7a4b5d4cb3ccc8042746f2a4396f4e62c70dbaff34458e85f8697ff6b1JmltdHM9MTc2MDgzMjAwMA&ptn=3&ver=2&hsh=4&fclid=16511d7b-5c5d-6902-36d6-0bf15d576874&u=a1aHR0cHM6Ly9pY3JpZm9ydW0ub3JnL2djcm1uX3BhY2lmaWNfMjAyNS8&ntb=1,"Jun 12, 2025· New 5-km Coral Bleaching Products - Higher spatial resolution is the improvement to NOAA Coral Reef Watch remote-sensing products most requested by coral reef ecosystem …",Bing,Coral Springs lutheran church adapted sensory friendly,2025-10-19T12:57:21.063998
Over 40% of coral species face extinction – IUCN Red List,https://www.bing.com/ck/a?!&&p=f27576ed76ebabd4afde6f5edbb85eac99a997e5b223356f9af3bab573e6d3efJmltdHM9MTc2MDgzMjAwMA&ptn=3&ver=2&hsh=4&fclid=16511d7b-5c5d-6902-36d6-0bf15d576874&u=a1aHR0cHM6Ly9pY3JpZm9ydW0ub3JnL2l1Y24tcmVkLWxpc3QtY29yYWxyZWVmLw&ntb=1,"Nov 13, 2024· Forty-four per cent of reef-building coral species globally are at risk of extinction, the IUCN Red List of Threatened Species (TM) reveals following a global assessment announced …",Bing,Coral Springs lutheran church adapted sensory friendly,2025-10-19T12:57:21.064000
Homepage | ICRI,https://www.bing.com/ck/a?!&&p=f9264a2e9239c5d84232c6a4bb1b5aacf4d43f3620a002929bba144e30efbecdJmltdHM9MTc2MDgzMjAwMA&ptn=3&ver=2&hsh=4&fclid=16511d7b-5c5d-6902-36d6-0bf15d576874&u=a1aHR0cHM6Ly9pY3JpZm9ydW0ub3JnLw&ntb=1,"4 days ago· The International Coral Reef Initiative (ICRI) is currently chaired by the Kingdom of Saudi Arabia, represented by the General Organisation for the Conservation of Coral Reefs and …",Bing,Coral Springs lutheran church adapted sensory friendly,2025-10-19T12:57:21.064002
Coral Reef Restoration Guidelines - ICRI,https://www.bing.com/ck/a?!&&p=38bd874724797567bed26d4bc4d36b84cd4533ac301086a05e0431227596f787JmltdHM9MTc2MDgzMjAwMA&ptn=3&ver=2&hsh=4&fclid=16511d7b-5c5d-6902-36d6-0bf15d576874&u=a1aHR0cHM6Ly9pY3JpZm9ydW0ub3JnL2NvcmFscmVzdG9yYXRpb24v&ntb=1,Guide to Coral Reef Restoration: Optimizing efficiency and scale for in situ nurseries and outplanting (2025). Developed by the Coral Restoration Consortium’s (CRC) Field-based Propagation …,Bing,Coral Springs lutheran church adapted sensory friendly,2025-10-19T12:57:21.064004
Coral Restoration Database - ICRI,https://www.bing.com/ck/a?!&&p=091943959a2ab49a62b0e3197bcb5c01ea83b1418324ac686940506421ce703bJmltdHM9MTc2MDgzMjAwMA&ptn=3&ver=2&hsh=4&fclid=16511d7b-5c5d-6902-36d6-0bf15d576874&u=a1aHR0cHM6Ly9pY3JpZm9ydW0ub3JnL3Jlc3RvcmF0aW9uL2NvcmFsLXJlc3RvcmF0aW9uLWRhdGFiYXNlLw&ntb=1,The Coral Restoration Database is now being hosted on the ICRI Forum it was previously hosted by the team at James Cook University who developed the Database after synthesising the available …,Bing,Coral Springs lutheran church adapted sensory friendly,2025-10-19T12:57:21.064006
Indonesia's Current Restoration Policies on Coral Reef …,https://www.bing.com/ck/a?!&&p=370ab225204584b0935ffdce176fa57a8334568448eced67c016599a82670525JmltdHM9MTc2MDgzMjAwMA&ptn=3&ver=2&hsh=4&fclid=16511d7b-5c5d-6902-36d6-0bf15d576874&u=a1aHR0cHM6Ly9pY3JpZm9ydW0ub3JnL3dwLWNvbnRlbnQvdXBsb2Fkcy8yMDI0LzA5LzIwMjQwOTEwLUluZG9uZXNpYS1SZXN0b3JhdGlvbi1Db3JhbC1SZWVmLTEucGRm&ntb=1,"Sep 10, 2024· Indonesia Coral Reef Garden (ICRG) is coral reef rehabilitation program which synergies the scientific and Socio-Economic in coral reef restoration for sustainability and …",Bing,Coral Springs lutheran church adapted sensory friendly,2025-10-19T12:57:21.064007
"Coral reefs of the Gulf of Mannar, Tamil Nadu, India - Decadal …",https://www.bing.com/ck/a?!&&p=9da8b6812f3a2a549115ef1588356e8768a0c40b015a0b5f133d4321a8e9a62eJmltdHM9MTc2MDgzMjAwMA&ptn=3&ver=2&hsh=4&fclid=16511d7b-5c5d-6902-36d6-0bf15d576874&u=a1aHR0cHM6Ly9pY3JpZm9ydW0ub3JnL2luZGlhcy1jb3JhbC1yZWVmcy0yMDI1Lw&ntb=1,"Jan 22, 2025· The Gulf of Mannar’s coral reefs are vital for marine biodiversity, coastal protection, and the livelihoods of thousands of fisherfolk. Continued conservation and adaptive management …",Bing,Coral Springs lutheran church adapted sensory friendly,2025-10-19T12:57:21.064009
"Hollywood, Los Angeles - Wikipedia",https://www.bing.com/ck/a?!&&p=f0664ab5f39e502cd0fa0c1ff3049edb140e0c827f318523dcc9ee011ec6f95fJmltdHM9MTc2MDgzMjAwMA&ptn=3&ver=2&hsh=4&fclid=16511d7b-5c5d-6902-36d6-0bf15d576874&u=a1aHR0cHM6Ly9lbi53aWtpcGVkaWEub3JnL3dpa2kvSG9sbHl3b29kLF9Mb3NfQW5nZWxlcw&ntb=1,"Hollywood, sometimes informally called Tinseltown, is a neighborhood and district [2] in the central region of Los Angeles County, California, within the city of Los Angeles. Its name has become …",Bing,Hollywood baptist church specialized neurodivergent,2025-10-19T12:57:38.587062
"Hollywood| History, Movies, Map, Sign, & Facts | Britannica",https://www.bing.com/ck/a?!&&p=682720bec234aaa33eb9972888de94e6b70d7baa312f524bf5b3748f730077c5JmltdHM9MTc2MDgzMjAwMA&ptn=3&ver=2&hsh=4&fclid=16511d7b-5c5d-6902-36d6-0bf15d576874&u=a1aHR0cHM6Ly93d3cuYnJpdGFubmljYS5jb20vcGxhY2UvSG9sbHl3b29kLUNhbGlmb3JuaWE&ntb=1,"4 days ago· Hollywood is a district within the city of Los Angeles, California, whose name is synonymous with the American film industry. It was laid out as a real-estate subdivision in 1887 …",Bing,Hollywood baptist church specialized neurodivergent,2025-10-19T12:57:38.587070
25 must-seeHollywood attractionson and off the Walk of Fame,https://www.bing.com/ck/a?!&&p=3a9f56fa05834acba8309cdc79ce720a918da54b850748f1a86b1020076a8386JmltdHM9MTc2MDgzMjAwMA&ptn=3&ver=2&hsh=4&fclid=16511d7b-5c5d-6902-36d6-0bf15d576874&u=a1aHR0cHM6Ly93d3cudGltZW91dC5jb20vbG9zLWFuZ2VsZXMvdGhpbmdzLXRvLWRvL3doYXQtdG8tc2VlLWluLWhvbGx5d29vZA&ntb=1,"Jul 23, 2025· The list of Hollywood attractions can be overwhelming, so stick to these iconic L.A. movie theaters, hotels, restaurants and landmarks",Bing,Hollywood baptist church specialized neurodivergent,2025-10-19T12:57:38.587072
"The Hollywood Reporter– Movie news, TV news, awards news ...",https://www.bing.com/ck/a?!&&p=eb0576e14d612313134a5bc52af6f875c7243455fd9adca7dc2adfecfa84ea21JmltdHM9MTc2MDgzMjAwMA&ptn=3&ver=2&hsh=4&fclid=16511d7b-5c5d-6902-36d6-0bf15d576874&u=a1aHR0cHM6Ly93d3cuaG9sbHl3b29kcmVwb3J0ZXIuY29tLw&ntb=1,"2 days ago· Movie news, TV news, awards news, lifestyle news, business news and more from The Hollywood Reporter.",Bing,Hollywood baptist church specialized neurodivergent,2025-10-19T12:57:38.587075
TheHollywoodMuseum - Your Day inHollywoodStarts at the ...,https://www.bing.com/ck/a?!&&p=0fa708e3450507d77fc75fafc5a164e3be274145c421e393e236a0691952e639JmltdHM9MTc2MDgzMjAwMA&ptn=3&ver=2&hsh=4&fclid=16511d7b-5c5d-6902-36d6-0bf15d576874&u=a1aHR0cHM6Ly90aGVob2xseXdvb2RtdXNldW0uY29tLw&ntb=1,"The Hollywood Museum, the official museum of Hollywood, has the most extensive collection of Hollywood memorabilia in the world.",Bing,Hollywood baptist church specialized neurodivergent,2025-10-19T12:57:38.587077
