title,url,snippet,source,search_query,search_timestamp
Apply Online for Disability Benefits | SSA,https://www.bing.com/ck/a?!&&p=7e237312d3262e8138dc6e8e9c961fb09e6c0bf40c98124ca6b2cddec1ceb9c0JmltdHM9MTc2MDgzMjAwMA&ptn=3&ver=2&hsh=4&fclid=16511d7b-5c5d-6902-36d6-0bf15d576874&u=a1aHR0cHM6Ly93d3cuc3NhLmdvdi9hcHBseWZvcmRpc2FiaWxpdHkvaW5kZXguaHRt&ntb=1,Social Security offers an online disability application you can complete at your convenience. Apply from the comfort of your home or any location at a time most convenient for you.,Bing,disability accommodations episcopal church Pembroke Pines,2025-10-19T12:20:24.183418
How Does Someone Become Eligible? | Disability Benefits | SSA,https://www.bing.com/ck/a?!&&p=d18161a5cae13dc010d19b82a25d43874de29a4c77474e18b1634f1ea4619e9bJmltdHM9MTc2MDgzMjAwMA&ptn=3&ver=2&hsh=4&fclid=16511d7b-5c5d-6902-36d6-0bf15d576874&u=a1aHR0cHM6Ly93d3cuc3NhLmdvdi9iZW5lZml0cy9kaXNhYmlsaXR5L3F1YWxpZnkuaHRtbA&ntb=1,"If you have worked enough to be eligible for disability benefits, we use a step-by-step process involving 5 questions to determine if you have a qualifying disability.",Bing,disability accommodations episcopal church Pembroke Pines,2025-10-19T12:20:24.183419
Form SSA-16 | Information You Need to Apply for Disability Benefits,https://www.bing.com/ck/a?!&&p=e188359f7e2fe609882662b4a3e7ffc418b685463f511f54b127a8dd307dff79JmltdHM9MTc2MDgzMjAwMA&ptn=3&ver=2&hsh=4&fclid=16511d7b-5c5d-6902-36d6-0bf15d576874&u=a1aHR0cHM6Ly93d3cuc3NhLmdvdi9mb3Jtcy9zc2EtMTYuaHRtbA&ntb=1,"An Adult Disability Report that collects more details about your illnesses, injuries or conditions, and your work history; Medical evidence already in your possession.",Bing,disability accommodations episcopal church Pembroke Pines,2025-10-19T12:20:24.183421
Disability Determination Process | Disability | SSA,https://www.bing.com/ck/a?!&&p=8ed34563e2d15f3d1b899871d88b1b3f71e6058001174d68c5a4ee53f2236c28JmltdHM9MTc2MDgzMjAwMA&ptn=3&ver=2&hsh=4&fclid=16511d7b-5c5d-6902-36d6-0bf15d576874&u=a1aHR0cHM6Ly93d3cuc3NhLmdvdi9kaXNhYmlsaXR5L2RldGVybWluYXRpb24uaHRt&ntb=1,Most Social Security disability claims are initially processed through a network of local Social Security Administration (SSA) field offices and State agencies (usually called Disability …,Bing,disability accommodations episcopal church Pembroke Pines,2025-10-19T12:20:24.183423
Understanding Social Security Disability Benefits | SSA,https://www.bing.com/ck/a?!&&p=155beac170d1944619e784d39db764dc24447fd69b07f4a88920e9e1fe39f02bJmltdHM9MTc2MDgzMjAwMA&ptn=3&ver=2&hsh=4&fclid=16511d7b-5c5d-6902-36d6-0bf15d576874&u=a1aHR0cHM6Ly9ibG9nLnNzYS5nb3YvdW5kZXJzdGFuZGluZy1zb2NpYWwtc2VjdXJpdHktZGlzYWJpbGl0eS1iZW5lZml0cy8&ntb=1,"Aug 12, 2021· Please read our publications, Disability Benefits and Supplemental Security Income (SSI), for more information. You can also see if you meet the requirements for disability benefits …",Bing,disability accommodations episcopal church Pembroke Pines,2025-10-19T12:20:24.183424
What you could get from Disability | SSA,https://www.bing.com/ck/a?!&&p=9182721907e445d701d8be5c8281bbc132738de69a51c197d99a93ed86465e15JmltdHM9MTc2MDgzMjAwMA&ptn=3&ver=2&hsh=4&fclid=16511d7b-5c5d-6902-36d6-0bf15d576874&u=a1aHR0cHM6Ly93d3cuc3NhLmdvdi9kaXNhYmlsaXR5L2Ftb3VudA&ntb=1,Disability benefits may include a monthly payment and Medicare health insurance. Get an estimated monthly payment based on your work history.,Bing,disability accommodations episcopal church Pembroke Pines,2025-10-19T12:20:24.183427
Supplemental Security Income (SSI) | SSA,https://www.bing.com/ck/a?!&&p=e1faab53638e413d3dde53e1ac6abcec259081cbeb0b57a1ee0e6664ce5d3126JmltdHM9MTc2MDgzMjAwMA&ptn=3&ver=2&hsh=4&fclid=16511d7b-5c5d-6902-36d6-0bf15d576874&u=a1aHR0cHM6Ly93d3cuc3NhLmdvdi9zc2k&ntb=1,"Little or no income, and Little or no resources, and A disability, blindness, or are age 65 or older. Find out if you might be eligible for SSI",Bing,disability accommodations episcopal church Pembroke Pines,2025-10-19T12:20:24.183431
"Official Sarasota, FL Tourism Guide | Visit Sarasota County",https://www.bing.com/ck/a?!&&p=45a507988d4bdb05082c3390e98ff44351ff30b8571816793841a9141aca5a7bJmltdHM9MTc2MDgzMjAwMA&ptn=3&ver=2&hsh=4&fclid=16511d7b-5c5d-6902-36d6-0bf15d576874&u=a1aHR0cHM6Ly93d3cudmlzaXRzYXJhc290YS5jb20v&ntb=1,"Discover Sarasota, Florida's white-sand beaches, arts & culture, dining, and shopping. Plan your perfect trip with our official guide, tips, and deals.",Bing,Sarasota baptist church one-on-one support,2025-10-19T12:29:12.087625
Welcome to Sarasota! - Visit Sarasota County,https://www.bing.com/ck/a?!&&p=636e21dfe38a5adbd33464c526d3bb29aa4439da84bb4ecfac029f8f86fd56e0JmltdHM9MTc2MDgzMjAwMA&ptn=3&ver=2&hsh=4&fclid=16511d7b-5c5d-6902-36d6-0bf15d576874&u=a1aHR0cHM6Ly93d3cudmlzaXRzYXJhc290YS5jb20vd2VsY29tZS1zYXJhc290YQ&ntb=1,"Welcome to Sarasota! We at Visit Sarasota County welcome you to our area and invite you to join in special savings with deals at local restaurants, attractions and more. You've seen us around …",Bing,Sarasota baptist church one-on-one support,2025-10-19T12:29:12.087635
"Siesta Key Sarasota – #1 Beach, Village & Island Life",https://www.bing.com/ck/a?!&&p=69d3c51118cd531c8c94425096d65418e60dba6d6d37af9733aa3eb3f6076ccdJmltdHM9MTc2MDgzMjAwMA&ptn=3&ver=2&hsh=4&fclid=16511d7b-5c5d-6902-36d6-0bf15d576874&u=a1aHR0cHM6Ly93d3cudmlzaXRzYXJhc290YS5jb20vc2llc3RhLWtleQ&ntb=1,"Thanks to the large parking area, concession stands, the free trolley to get around the island and to downtown Sarasota, and nearby restaurants and shops of Siesta Key Village, you can plan your …",Bing,Sarasota baptist church one-on-one support,2025-10-19T12:29:12.087639
Sarasota Attractions & Tours | Plan Your Florida Getaway | Visit ...,https://www.bing.com/ck/a?!&&p=1033d276c5efb2aa5483926274c8c489d670aa19ccd34b577d7d256afd78c54fJmltdHM9MTc2MDgzMjAwMA&ptn=3&ver=2&hsh=4&fclid=16511d7b-5c5d-6902-36d6-0bf15d576874&u=a1aHR0cHM6Ly93d3cudmlzaXRzYXJhc290YS5jb20vYXR0cmFjdGlvbnMtdG91cnM&ntb=1,"Discover the best of Sarasota! Explore top attractions like The Ringling, relax on Siesta Key Beach, and enjoy unique boat and trolley tours.",Bing,Sarasota baptist church one-on-one support,2025-10-19T12:29:12.087641
"Discover Sarasota – Beaches, Arts, Culture & Outdoor Fun",https://www.bing.com/ck/a?!&&p=165b236d8861063bb4ae583eca552e4f62f1fe2fdac14dd9337037b09a5b5775JmltdHM9MTc2MDgzMjAwMA&ptn=3&ver=2&hsh=4&fclid=16511d7b-5c5d-6902-36d6-0bf15d576874&u=a1aHR0cHM6Ly93d3cudmlzaXRzYXJhc290YS5jb20vc2FyYXNvdGE&ntb=1,"Explore Sarasota’s award‑winning beaches, world‑class arts, shopping, dining, nature parks, festivals & family adventures on Florida’s Cultural Coast.",Bing,Sarasota baptist church one-on-one support,2025-10-19T12:29:12.087643
"Things to Do in Sarasota – Culture, Beaches & Outdoor Fun",https://www.bing.com/ck/a?!&&p=1d526fbd1e2bb1e08d4f5b8d4720fbfd4c091bf47855115466b9d6ccd52a16f7JmltdHM9MTc2MDgzMjAwMA&ptn=3&ver=2&hsh=4&fclid=16511d7b-5c5d-6902-36d6-0bf15d576874&u=a1aHR0cHM6Ly93d3cudmlzaXRzYXJhc290YS5jb20vdGhpbmdzLXRvLWRv&ntb=1,"Explore Sarasota’s top attractions: art museums, botanical gardens, beaches, parks, dining, shopping, festivals & family‑friendly adventures.",Bing,Sarasota baptist church one-on-one support,2025-10-19T12:29:12.087645
Selby Aquatic Center - Sarasota County Sports,https://www.bing.com/ck/a?!&&p=59f40b00434476561d83148bf2f04ad9c63076a62af76bd9843806cbe224edf4JmltdHM9MTc2MDgzMjAwMA&ptn=3&ver=2&hsh=4&fclid=16511d7b-5c5d-6902-36d6-0bf15d576874&u=a1aHR0cHM6Ly9zcG9ydHMudmlzaXRzYXJhc290YS5jb20vc3BvcnRzLWZhY2lsaXRpZXMvc2VsYnktYXF1YXRpYy1jZW50ZXI&ntb=1,"The Selby Aquatics Center offers birthday and corporate parties on the inflatable obstacle course, team and college rentals, and swim team practice for visitors to Sarasota.",Bing,Sarasota baptist church one-on-one support,2025-10-19T12:29:12.087648
Events & Festivals - Visit Sarasota County,https://www.bing.com/ck/a?!&&p=f8601c2ee4220cf838cc21ea6e88fd64c44e6043807385087d4e3bf18a805434JmltdHM9MTc2MDgzMjAwMA&ptn=3&ver=2&hsh=4&fclid=16511d7b-5c5d-6902-36d6-0bf15d576874&u=a1aHR0cHM6Ly93d3cudmlzaXRzYXJhc290YS5jb20vZXZlbnRzLWZlc3RpdmFscw&ntb=1,Sarasota is a cultural hub with can’t-miss celebrations in all seasons. Here’s a guide highlighting some of our top annual happenings — bringing visitors near and far to Florida’s Gulf Coast.,Bing,Sarasota baptist church one-on-one support,2025-10-19T12:29:12.087650
77 Siesta Islander: Your Free Trolley to Siesta Key - Visit Sarasota,https://www.bing.com/ck/a?!&&p=286ff6043de9f509e088ec76103c793421ec0775daf67005d30325d192dc8549JmltdHM9MTc2MDgzMjAwMA&ptn=3&ver=2&hsh=4&fclid=16511d7b-5c5d-6902-36d6-0bf15d576874&u=a1aHR0cHM6Ly93d3cudmlzaXRzYXJhc290YS5jb20vYXJ0aWNsZS83Ny1zaWVzdGEtaXNsYW5kZXIteW91ci1icmVlenktcmlkZS1zaWVzdGEta2V5LWFuZC1iZXlvbmQ&ntb=1,"Nov 28, 2024· Ride the free Siesta Islander trolley! Connect from Downtown Sarasota to Siesta Key's beaches and villages, avoiding traffic and parking hassles.",Bing,Sarasota baptist church one-on-one support,2025-10-19T12:29:12.087652
Big Things are Happening: 2025 in Sarasota,https://www.bing.com/ck/a?!&&p=d6ce5640353181a8ae4734834d416f0f69084d5628b1db677967a5c3e8dbaebaJmltdHM9MTc2MDgzMjAwMA&ptn=3&ver=2&hsh=4&fclid=16511d7b-5c5d-6902-36d6-0bf15d576874&u=a1aHR0cHM6Ly93d3cudmlzaXRzYXJhc290YS5jb20vYmxvZy9iaWctdGhpbmdzLWFyZS1oYXBwZW5pbmctMjAyNS1zYXJhc290YQ&ntb=1,"There's a lot to be excited about in Sarasota as we welcome the new year. From a revamped aquarium to an expanded cycling trail to many other things, your 2025 Sarasota calendar will be …",Bing,Sarasota baptist church one-on-one support,2025-10-19T12:29:12.087655
Nazarene (sect) -Wikipedia,https://www.bing.com/ck/a?!&&p=b6dc41223c560d5d5f6b8fec901d6feda616457e9a574c28e8dbb9463ad7f9d2JmltdHM9MTc2MDgzMjAwMA&ptn=3&ver=2&hsh=4&fclid=16511d7b-5c5d-6902-36d6-0bf15d576874&u=a1aHR0cHM6Ly9lbi5tLndpa2lwZWRpYS5vcmcvd2lraS9OYXphcmVuZV8oc2VjdCk&ntb=1,"The English term Nazarene is commonly used to translate two related Greek words that appear in the New Testament: Nazōraios (Ναζωραῖος, Ναζαραῖος) (""Nazorean"") and Nazarēnos …",Bing,nazarene church peer support Pinellas Park,2025-10-19T12:29:36.605219
Church of theNazarene- Christian Holiness Denomination,https://www.bing.com/ck/a?!&&p=ba31dd224980119b1b386d2cb7c74ab7c6aa3adf9e1f1f78fc54b14b0d6e7c4fJmltdHM9MTc2MDgzMjAwMA&ptn=3&ver=2&hsh=4&fclid=16511d7b-5c5d-6902-36d6-0bf15d576874&u=a1aHR0cHM6Ly9uYXphcmVuZS5vcmcv&ntb=1,"As a global community of faith, we are commissioned to take the Good News of life in Jesus Christ to people everywhere and to spread the message of scriptural holiness across the lands. The …",Bing,nazarene church peer support Pinellas Park,2025-10-19T12:29:36.605227
Welcome | Avon Park Church of theNazarene,https://www.bing.com/ck/a?!&&p=b07475018c7ac7ebde11fb2b12f62595ef544367404eb1fdb9d3cde820b30038JmltdHM9MTc2MDgzMjAwMA&ptn=3&ver=2&hsh=4&fclid=16511d7b-5c5d-6902-36d6-0bf15d576874&u=a1aHR0cHM6Ly9jdC5hcG5hemFyZW5lLm9yZy8&ntb=1,Avon Park Church of the Nazarene in South Central Florida provides a traditional service worship experience.,Bing,nazarene church peer support Pinellas Park,2025-10-19T12:29:36.605230
"Nazarene|NazareneSect, Jesus, Judaism | Britannica",https://www.bing.com/ck/a?!&&p=4c63f8cd35f6c3c183f75a201757d109d64fe48825adf27682ef040ac26a2406JmltdHM9MTc2MDgzMjAwMA&ptn=3&ver=2&hsh=4&fclid=16511d7b-5c5d-6902-36d6-0bf15d576874&u=a1aHR0cHM6Ly93d3cuYnJpdGFubmljYS5jb20vdG9waWMvTmF6YXJlbmU&ntb=1,"Nazarene, in the New Testament, a title applied to Jesus and, later, to those who followed his teachings (Acts 24:5). In the Greek text there appear two forms of the word: the simple form, …",Bing,nazarene church peer support Pinellas Park,2025-10-19T12:29:36.605232
Avon Parkside Church of theNazarene,https://www.bing.com/ck/a?!&&p=62694398891bf8219c7ee306f1399c1faf4284d62416a7d712fd0cb1717f38b5JmltdHM9MTc2MDgzMjAwMA&ptn=3&ver=2&hsh=4&fclid=16511d7b-5c5d-6902-36d6-0bf15d576874&u=a1aHR0cHM6Ly93d3cuYXZvbnBhcmtzaWRlLmNvbS8&ntb=1,Avon Parkside Church of the Nazarene is focused on coming alongside families of all dynamics. We want to see the next generation raised up to be leaders in their faith.,Bing,nazarene church peer support Pinellas Park,2025-10-19T12:29:36.605234
NazareneChurch Beliefs vs Other Christian Denominations,https://www.bing.com/ck/a?!&&p=81e6062bd448a57419453e9faa6980f071e0ae62b8044cbe4ec140be81050957JmltdHM9MTc2MDgzMjAwMA&ptn=3&ver=2&hsh=4&fclid=16511d7b-5c5d-6902-36d6-0bf15d576874&u=a1aHR0cHM6Ly93d3cuYmFkYXhlbmF6Lm9yZy9uYXphcmVuZS1jaHVyY2gtYmVsaWVmcy12cy1vdGhlci1jaHJpc3RpYW4tZGVub21pbmF0aW9ucy8&ntb=1,"Many individuals seek clarity on key doctrines such as “ means of grace,” “ infant baptism,” and the role of sacraments. This article will explore the core beliefs of the Nazarene Church, its historical …",Bing,nazarene church peer support Pinellas Park,2025-10-19T12:29:36.605236
Church of the Nazarene Beliefsand Worship Practices,https://www.bing.com/ck/a?!&&p=79dbfe599f51ee32b963dec0c0f1eb65405ad110491997df4a980ac31ac76ce0JmltdHM9MTc2MDgzMjAwMA&ptn=3&ver=2&hsh=4&fclid=16511d7b-5c5d-6902-36d6-0bf15d576874&u=a1aHR0cHM6Ly93d3cubGVhcm5yZWxpZ2lvbnMuY29tL2NodXJjaC1vZi10aGUtbmF6YXJlbmUtYmVsaWVmcy1wcmFjdGljZXMtNzAwMDU4&ntb=1,"Jul 20, 2024· Two Nazarene beliefs set this Christian denomination apart from other evangelicals: the belief that a person can experience entire sanctification, or personal holiness, in this life, and …",Bing,nazarene church peer support Pinellas Park,2025-10-19T12:29:36.605237
TopicalBible:Nazarene,https://www.bing.com/ck/a?!&&p=0e94abcf06b59fd1b8eda13d3b0fc49d59c75515406e8d386f5acd1ef723fa2eJmltdHM9MTc2MDgzMjAwMA&ptn=3&ver=2&hsh=4&fclid=16511d7b-5c5d-6902-36d6-0bf15d576874&u=a1aHR0cHM6Ly9iaWJsZWh1Yi5jb20vdG9waWNhbC9uL25hemFyZW5lLmh0bQ&ntb=1,"In summary, the term ""Nazarene"" is a multifaceted designation that connects Jesus to His earthly origins, fulfills prophetic expectations, and identifies His early followers. It highlights the paradox …",Bing,nazarene church peer support Pinellas Park,2025-10-19T12:29:36.605239
NAZARENES: Who are we? | Avon Park Church of theNazarene,https://www.bing.com/ck/a?!&&p=688cf4098523b6f677f32d211e7aaf06cee7bfcbc492c2202dc179a1a2ab78bdJmltdHM9MTc2MDgzMjAwMA&ptn=3&ver=2&hsh=4&fclid=16511d7b-5c5d-6902-36d6-0bf15d576874&u=a1aHR0cHM6Ly9hcG5hei5jaHVyY2h0cmFjLmNvbS9jYXJkLzQz&ntb=1,"The Church of the Nazarene is a Protestant Christian church in the Wesleyan-Holiness tradition, tracing its roots to an anniversary date of 1908. It was founded to spread the message of …",Bing,nazarene church peer support Pinellas Park,2025-10-19T12:29:36.605240
Church of the Nazarene-Wikipedia,https://www.bing.com/ck/a?!&&p=ebef32dd7074979f47d956543329f51aea2e5fdedf2e6e8c9970b78e97abbd72JmltdHM9MTc2MDgzMjAwMA&ptn=3&ver=2&hsh=4&fclid=16511d7b-5c5d-6902-36d6-0bf15d576874&u=a1aHR0cHM6Ly9lbi5tLndpa2lwZWRpYS5vcmcvd2lraS9DaHVyY2hfb2ZfdGhlX05hemFyZW5l&ntb=1,"It is the largest denomination in the world aligned with the Wesleyan-Holiness movement, with just under 3 million members worldwide. The Church of the Nazarene was a member denomination of …",Bing,nazarene church peer support Pinellas Park,2025-10-19T12:29:36.605242
The 15 best things to do inNaples-Lonely Planet,https://www.bing.com/ck/a?!&&p=dc6bd022c7d721601607deddab4de8bd5f079034af3d76090626c2cf5369c554JmltdHM9MTc2MDgzMjAwMA&ptn=3&ver=2&hsh=4&fclid=16511d7b-5c5d-6902-36d6-0bf15d576874&u=a1aHR0cHM6Ly93d3cubG9uZWx5cGxhbmV0LmNvbS9hcnRpY2xlcy90b3AtdGhpbmdzLXRvLWRvLWluLW5hcGxlcw&ntb=1,"Sep 1, 2025· Here are 15 ways to take in the charm of this southern Italian city.",Bing,Naples reformed church buddy program,2025-10-19T12:29:51.015177
"Naples| Italy, History, Map, & Points of Interest | Britannica",https://www.bing.com/ck/a?!&&p=f67b786353769ae13e5423cc7699a34ac32823ba02c4b55cca9dd3efaa6d3a36JmltdHM9MTc2MDgzMjAwMA&ptn=3&ver=2&hsh=4&fclid=16511d7b-5c5d-6902-36d6-0bf15d576874&u=a1aHR0cHM6Ly93d3cuYnJpdGFubmljYS5jb20vcGxhY2UvTmFwbGVzLUl0YWx5&ntb=1,"6 days ago· Naples, city, capital of Naples provincia, Campania regione, southern Italy. It lies on the west coast of the Italian peninsula, 120 miles (190 km) southeast of Rome. On its celebrated …",Bing,Naples reformed church buddy program,2025-10-19T12:29:51.015189
"Naples, Florida- Wikipedia",https://www.bing.com/ck/a?!&&p=b2845727a279283462786dd01da4903f1436714f6cdddd56faba5d1ec1800f3aJmltdHM9MTc2MDgzMjAwMA&ptn=3&ver=2&hsh=4&fclid=16511d7b-5c5d-6902-36d6-0bf15d576874&u=a1aHR0cHM6Ly9lbi53aWtpcGVkaWEub3JnL3dpa2kvTmFwbGVzLF9GbG9yaWRh&ntb=1,"Naples is a city in Collier County, Florida, United States. As of the 2020 census, the population was 19,115, down from 19,539 at the 2010 census. Naples is a principal city of the Naples–Marco …",Bing,Naples reformed church buddy program,2025-10-19T12:29:51.015193
VisitNaplesOfficial - The guide of the city ofNaples,https://www.bing.com/ck/a?!&&p=7eb9410bdb6f320b3053be37d69dd26a8493a920826848e26edd97baf42535f4JmltdHM9MTc2MDgzMjAwMA&ptn=3&ver=2&hsh=4&fclid=16511d7b-5c5d-6902-36d6-0bf15d576874&u=a1aHR0cHM6Ly93d3cudmlzaXRuYXBsZXMuZXUvZW4&ntb=1,Visit Naples Official the guide of the city of Naples. The best restaurants in Naples. Search for your ideal stay. Discover the Neapolitan traditions,Bing,Naples reformed church buddy program,2025-10-19T12:29:51.015198
"29 TOP THINGS to Do inNaples, Italy (2025 Travel Guide)",https://www.bing.com/ck/a?!&&p=37dbdc91e7035d1b2db1158e1c92c028ee85554810c23e8d916a41ba1a77c5b4JmltdHM9MTc2MDgzMjAwMA&ptn=3&ver=2&hsh=4&fclid=16511d7b-5c5d-6902-36d6-0bf15d576874&u=a1aHR0cHM6Ly93d3cuc2F2b3JpbmdpdGFseS5jb20vbmFwbGVzLWl0YWx5Lw&ntb=1,"Feb 14, 2025· Naples or Napoli, on Italy's Amalfi Coast, is a gem for culture, history, and food. This 2025 guide covers 29 must-see spots. Learn all about where to stay in Naples, what to do in …",Bing,Naples reformed church buddy program,2025-10-19T12:29:51.015201
Top 10 Things to See inNaples- The Ultimate Guide,https://www.bing.com/ck/a?!&&p=e79cc34bc18c2c9598fa31732c8caedf0b0a4a57ce19ed1257633978ead06285JmltdHM9MTc2MDgzMjAwMA&ptn=3&ver=2&hsh=4&fclid=16511d7b-5c5d-6902-36d6-0bf15d576874&u=a1aHR0cHM6Ly93d3cubmFwbGVzaW5zaWRlci5jb20vZW4vZS9uYXBsZXMtaXRhbHktdG9wLTEwLXNpZ2h0cw&ntb=1,Naples can be overwhelming for a first-time visitor. Here are our insider tips on the top sights to focus on to experience the best of La Bella Napoli.,Bing,Naples reformed church buddy program,2025-10-19T12:29:51.015204
VisitingNaples: What to Know Before You Go (+ Honest Tips ...,https://www.bing.com/ck/a?!&&p=893966c5a05c44de3f05ca79ee5ff4db751a77c18a2d3588ffa550e1096995dcJmltdHM9MTc2MDgzMjAwMA&ptn=3&ver=2&hsh=4&fclid=16511d7b-5c5d-6902-36d6-0bf15d576874&u=a1aHR0cHM6Ly9jdWx0dXJlZHZveWFnZXMuY29tL3Zpc2l0aW5nLW5hcGxlcy1pdGFseS1ndWlkZS8&ntb=1,"Jul 31, 2025· Visiting Naples? Here’s what to know before you go — including real safety tips, cultural insight, and what makes this gritty, unforgettable city worth your time.",Bing,Naples reformed church buddy program,2025-10-19T12:29:51.015205
"Naples, Italy: All You Must Know Before You Go (2025 ...",https://www.bing.com/ck/a?!&&p=12cb196737932108e42a672d110c7d7a295557c38e1b6d2462c4b0d02f01e055JmltdHM9MTc2MDgzMjAwMA&ptn=3&ver=2&hsh=4&fclid=16511d7b-5c5d-6902-36d6-0bf15d576874&u=a1aHR0cHM6Ly93d3cudHJpcGFkdmlzb3IuY29tL1RvdXJpc20tZzE4Nzc4NS1OYXBsZXNfUHJvdmluY2Vfb2ZfTmFwbGVzX0NhbXBhbmlhLVZhY2F0aW9ucy5odG1s&ntb=1,"Naples Tourism: Tripadvisor has 1,362,778 reviews of Naples Hotels, Attractions, and Restaurants making it your best Naples resource.",Bing,Naples reformed church buddy program,2025-10-19T12:29:51.015207
15 BestThings to Do in Naples(Italy) - The Crazy Tourist,https://www.bing.com/ck/a?!&&p=ca80275562dbeabf5a705e947f261576dbaa7abc169df61335b0f245a58a9684JmltdHM9MTc2MDgzMjAwMA&ptn=3&ver=2&hsh=4&fclid=16511d7b-5c5d-6902-36d6-0bf15d576874&u=a1aHR0cHM6Ly93d3cudGhlY3Jhenl0b3VyaXN0LmNvbS8xNS1iZXN0LXRoaW5ncy1uYXBsZXMtaXRhbHkv&ntb=1,"Jun 3, 2022· Naples is a vast city located on the western coast of Italy facing the Tyrrhenian Sea. This colossal metropolis is the third largest city in Italy behind Rome and Milan with a population …",Bing,Naples reformed church buddy program,2025-10-19T12:29:51.015209
PORT| English meaning - Cambridge Dictionary,https://www.bing.com/ck/a?!&&p=219eb82d8bf001ec130c925317d31001de57d9255b150caa23f540b07100c2c3JmltdHM9MTc2MDgzMjAwMA&ptn=3&ver=2&hsh=4&fclid=16511d7b-5c5d-6902-36d6-0bf15d576874&u=a1aHR0cHM6Ly9kaWN0aW9uYXJ5LmNhbWJyaWRnZS5vcmcvZGljdGlvbmFyeS9lbmdsaXNoL3BvcnQ&ntb=1,"PORT definition: 1. a town by the sea or by a river that has a harbour, or the harbour itself: 2. a part of a…. Learn more.",Bing,Port St Lucie ministry alternative format,2025-10-19T12:30:12.307437
PORTDefinition & Meaning -Merriam-Webster,https://www.bing.com/ck/a?!&&p=6cb31b2f805ec091070522501b19139f87c915de7b84c1a8225947f3ebe6defdJmltdHM9MTc2MDgzMjAwMA&ptn=3&ver=2&hsh=4&fclid=16511d7b-5c5d-6902-36d6-0bf15d576874&u=a1aHR0cHM6Ly93d3cubWVycmlhbS13ZWJzdGVyLmNvbS9kaWN0aW9uYXJ5L3BvcnQ&ntb=1,The meaning of PORT is a place where ships may ride secure from storms : haven. How to use port in a sentence.,Bing,Port St Lucie ministry alternative format,2025-10-19T12:30:12.307446
What Is aPort? Network Ports &PortNumbers Explained,https://www.bing.com/ck/a?!&&p=7a77f12ddfcdc890910bef427a9cf676189a507e1cf1a3fca158aed542844487JmltdHM9MTc2MDgzMjAwMA&ptn=3&ver=2&hsh=4&fclid=16511d7b-5c5d-6902-36d6-0bf15d576874&u=a1aHR0cHM6Ly93d3cud2hhdGlzbXlpcC5jb20vd2hhdC1pcy1hLXBvcnQv&ntb=1,"What is a port number? Ports are essential to network connections, but what is a port number? A port number is a unique identifier used to specify a particular process or service on a host, such …",Bing,Port St Lucie ministry alternative format,2025-10-19T12:30:12.307448
Port- definition ofportby The Free Dictionary,https://www.bing.com/ck/a?!&&p=4c429ce417c96b7df7a1fde80c6cdae3a9609dcb9940aaa3d046455cff93fb6dJmltdHM9MTc2MDgzMjAwMA&ptn=3&ver=2&hsh=4&fclid=16511d7b-5c5d-6902-36d6-0bf15d576874&u=a1aHR0cHM6Ly93d3cudGhlZnJlZWRpY3Rpb25hcnkuY29tL3BvcnQ&ntb=1,"Define port. port synonyms, port pronunciation, port translation, English dictionary definition of port. n. 1. a. A place on a waterway with facilities for loading and unloading ships. b. A city or town on …",Bing,Port St Lucie ministry alternative format,2025-10-19T12:30:12.307450
PortInfo -PortofLong Beach,https://www.bing.com/ck/a?!&&p=522ad815b1579891a71978ae57c507872e700ef9a6a21632fb0c42cd8cc4e719JmltdHM9MTc2MDgzMjAwMA&ptn=3&ver=2&hsh=4&fclid=16511d7b-5c5d-6902-36d6-0bf15d576874&u=a1aHR0cHM6Ly9wb2xiLmNvbS9wb3J0LWluZm8v&ntb=1,"Find facts and figures about the Port, our mission and vision, contact information, news and project updates, Port history and info about the website.",Bing,Port St Lucie ministry alternative format,2025-10-19T12:30:12.307452
China imposes retaliatoryportfees on American-owned ships …,https://www.bing.com/ck/a?!&&p=3c663e49c15d6833e7f3718e1474da3cb638e1c01c48129f9b26a9a16645e497JmltdHM9MTc2MDgzMjAwMA&ptn=3&ver=2&hsh=4&fclid=16511d7b-5c5d-6902-36d6-0bf15d576874&u=a1aHR0cHM6Ly93d3cuY2JzbmV3cy5jb20vbmV3cy9jaGluYS1wb3J0LWZlZXMtdHJ1bXAteGktdHJhZGUtbWVldGluZy8&ntb=1,"Oct 10, 2025· The tit-for-tat port fees come before expected trade talks between U.S. President Donald Trump and Chinese leader Xi Jinping.",Bing,Port St Lucie ministry alternative format,2025-10-19T12:30:12.307453
Port- National Geographic Society,https://www.bing.com/ck/a?!&&p=6c81089422d21fa2a21edc5b48f65b6b476f1cb75abb1ed53b77c4080dacdfeeJmltdHM9MTc2MDgzMjAwMA&ptn=3&ver=2&hsh=4&fclid=16511d7b-5c5d-6902-36d6-0bf15d576874&u=a1aHR0cHM6Ly9lZHVjYXRpb24ubmF0aW9uYWxnZW9ncmFwaGljLm9yZy9yZXNvdXJjZS9wb3J0Lw&ntb=1,"Oct 30, 2024· A port is a landing place for ships on a coast, river, or lake. Ships dock at ports to load and unload their cargo and passengers.",Bing,Port St Lucie ministry alternative format,2025-10-19T12:30:12.307455
What Are Ports? | How Do Ports Work? | Akamai,https://www.bing.com/ck/a?!&&p=03933cd681e6f961163be74035a89e652f816ff21402de38ca01cbc7f8ca9018JmltdHM9MTc2MDgzMjAwMA&ptn=3&ver=2&hsh=4&fclid=16511d7b-5c5d-6902-36d6-0bf15d576874&u=a1aHR0cHM6Ly93d3cuYWthbWFpLmNvbS9nbG9zc2FyeS93aGF0LWFyZS1wb3J0cw&ntb=1,"Learn what a port is, how they work, and their role in delivering information and packets across the internet.",Bing,Port St Lucie ministry alternative format,2025-10-19T12:30:12.307457
Port-MDN Web Docs,https://www.bing.com/ck/a?!&&p=e5a791dd59e5a293460095abbc1c5233d108498a16843ce550b8e42f3dafb693JmltdHM9MTc2MDgzMjAwMA&ptn=3&ver=2&hsh=4&fclid=16511d7b-5c5d-6902-36d6-0bf15d576874&u=a1aHR0cHM6Ly9kZXZlbG9wZXIubW96aWxsYS5vcmcvZW4tVVMvZG9jcy9HbG9zc2FyeS9Qb3J0&ntb=1,"Jul 11, 2025· Port For a computer connected to a network with an IP address, a port is a communication endpoint. Ports are designated by numbers, and below 1024 each port is …",Bing,Port St Lucie ministry alternative format,2025-10-19T12:30:12.307458
Common Ports Cheat Sheet: The Ultimate List - StationX,https://www.bing.com/ck/a?!&&p=0f9525c0f3f07095898f19d5582abaf8ea9aa49bec37965fffcb8ce0707e5b47JmltdHM9MTc2MDgzMjAwMA&ptn=3&ver=2&hsh=4&fclid=16511d7b-5c5d-6902-36d6-0bf15d576874&u=a1aHR0cHM6Ly93d3cuc3RhdGlvbngubmV0L2NvbW1vbi1wb3J0cy1jaGVhdC1zaGVldC8&ntb=1,"May 29, 2025· Use this comprehensive common ports cheat sheet to learn about any port and several common protocols. It also includes a special search and copy function.",Bing,Port St Lucie ministry alternative format,2025-10-19T12:30:12.307460
