title,url,snippet,source,search_query,search_timestamp
NORTH| English meaning - Cambridge Dictionary,https://www.bing.com/ck/a?!&&p=521ba800fa84b0d31be7f7b52c9a36837490a1793212d58a9b5de79b5967d7afJmltdHM9MTc2MDgzMjAwMA&ptn=3&ver=2&hsh=4&fclid=16511d7b-5c5d-6902-36d6-0bf15d576874&u=a1aHR0cHM6Ly9kaWN0aW9uYXJ5LmNhbWJyaWRnZS5vcmcvZGljdGlvbmFyeS9lbmdsaXNoL25vcnRo&ntb=1,"NORTH definition: 1. the direction that goes towards the part of the earth above the equator, opposite to the south…. Learn more.",Bing,North Miami Beach lutheran church sensory friendly,2025-10-19T12:59:01.279516
"north- Wiktionary, the free dictionary",https://www.bing.com/ck/a?!&&p=73d12265b66e22c06ae234a6fb2726910e53d553041dd5a7392619a33ab4f6a5JmltdHM9MTc2MDgzMjAwMA&ptn=3&ver=2&hsh=4&fclid=16511d7b-5c5d-6902-36d6-0bf15d576874&u=a1aHR0cHM6Ly9lbi53aWt0aW9uYXJ5Lm9yZy93aWtpL25vcnRo&ntb=1,"6 days ago· north (countable and uncountable, plural norths) The direction towards the pole to the left-hand side of someone facing east, specifically 0°, or (on another celestial object) the …",Bing,North Miami Beach lutheran church sensory friendly,2025-10-19T12:59:01.279519
NORTHDefinition & Meaning - Merriam-Webster,https://www.bing.com/ck/a?!&&p=fefda9dc38051cfca299e6459241509a91eff3873cde765c261f57815262ce33JmltdHM9MTc2MDgzMjAwMA&ptn=3&ver=2&hsh=4&fclid=16511d7b-5c5d-6902-36d6-0bf15d576874&u=a1aHR0cHM6Ly93d3cubWVycmlhbS13ZWJzdGVyLmNvbS9kaWN0aW9uYXJ5L25vcnRo&ntb=1,"The meaning of NORTH is to, toward, or in the north. How to use north in a sentence.",Bing,North Miami Beach lutheran church sensory friendly,2025-10-19T12:59:01.279521
NORTH definitionand meaning | Collins English Dictionary,https://www.bing.com/ck/a?!&&p=6fbb14f34762e75f95ca1603a4a9b49e167517a21fd83c0c99790dcab5abb7a9JmltdHM9MTc2MDgzMjAwMA&ptn=3&ver=2&hsh=4&fclid=16511d7b-5c5d-6902-36d6-0bf15d576874&u=a1aHR0cHM6Ly93d3cuY29sbGluc2RpY3Rpb25hcnkuY29tL2RpY3Rpb25hcnkvZW5nbGlzaC9ub3J0aA&ntb=1,"17 meanings: 1. one of the four cardinal points of the compass, at 0° or 360°, that is 90° from east and west and 180° from.... Click for more definitions.",Bing,North Miami Beach lutheran church sensory friendly,2025-10-19T12:59:01.279523
Italian Restaurant in Irvine |North Italia,https://www.bing.com/ck/a?!&&p=f0bd1f6d1e3e2fde70a69083798cf87df07cf19c2b564751775858d8a619f5b7JmltdHM9MTc2MDgzMjAwMA&ptn=3&ver=2&hsh=4&fclid=16511d7b-5c5d-6902-36d6-0bf15d576874&u=a1aHR0cHM6Ly93d3cubm9ydGhpdGFsaWEuY29tL2xvY2F0aW9ucy9pcnZpbmUtY2Ev&ntb=1,Visit North Italia in Irvine for Italian cuisine handmade from scratch. Let's go to North. Contact us for reservations or stop by anytime.,Bing,North Miami Beach lutheran church sensory friendly,2025-10-19T12:59:01.279525
NORTHDefinition & Meaning |Dictionary.com,https://www.bing.com/ck/a?!&&p=f0a413ee5657509a77d888902db3fe9f5e4b8270ea861bd609107b7360f5070fJmltdHM9MTc2MDgzMjAwMA&ptn=3&ver=2&hsh=4&fclid=16511d7b-5c5d-6902-36d6-0bf15d576874&u=a1aHR0cHM6Ly93d3cuZGljdGlvbmFyeS5jb20vYnJvd3NlL25vcnRo&ntb=1,"North definition: a cardinal point of the compass, lying in the plane of the meridian and to the left of a person facing the rising sun. N. See examples of NORTH used in a sentence.",Bing,North Miami Beach lutheran church sensory friendly,2025-10-19T12:59:01.279528
Login -North,https://www.bing.com/ck/a?!&&p=3638abfb3dee9aa07714aa5be0934358ee557cd9abba7ef5179cb50435fb3be2JmltdHM9MTc2MDgzMjAwMA&ptn=3&ver=2&hsh=4&fclid=16511d7b-5c5d-6902-36d6-0bf15d576874&u=a1aHR0cHM6Ly93d3cubm9ydGguY29tL2xvZ2lu&ntb=1,Industries Retail Convenience Clothing/Apparel In-Person Payment APIs for Retail Restaurant Quick-Service Full-Service Specialty CBD Telemedicine Online Pharmacy Gaming Online Dating Big …,Bing,North Miami Beach lutheran church sensory friendly,2025-10-19T12:59:01.279530
"Home -City of Melbourne, FL",https://www.bing.com/ck/a?!&&p=174e0acc6a86b9661ecfdd40199e074949cb52a38233b6fe3119dbea70441885JmltdHM9MTc2MDgzMjAwMA&ptn=3&ver=2&hsh=4&fclid=16511d7b-5c5d-6902-36d6-0bf15d576874&u=a1aHR0cHM6Ly93d3cubWVsYm91cm5lZmxvcmlkYS5vcmcvSG9tZQ&ntb=1,"4 days ago· The latest Melbourne Minute features fun summer camps, beachside's new water distribution pump station, and a tour of the new Joseph Pellicano Law Enforcement Center.",Bing,Melbourne churches autism trained,2025-10-19T12:59:15.939237
Melbourne- Wikipedia,https://www.bing.com/ck/a?!&&p=af8bcaa3aa584064d48103806586d97b5e7a549594aef0213f833d7d86f48233JmltdHM9MTc2MDgzMjAwMA&ptn=3&ver=2&hsh=4&fclid=16511d7b-5c5d-6902-36d6-0bf15d576874&u=a1aHR0cHM6Ly9lbi53aWtpcGVkaWEub3JnL3dpa2kvTWVsYm91cm5l&ntb=1,"The name is also used to specifically refer to the local government area named City of Melbourne, whose area is centred on the Melbourne central business district and some immediate surrounds. …",Bing,Melbourne churches autism trained,2025-10-19T12:59:15.939245
"Melbourne| History, Population, Map, Climate, & Facts | Britannica",https://www.bing.com/ck/a?!&&p=f485eba496602ce8e7454888139dd4dc6033b92bfaf928460560f2cd28867edfJmltdHM9MTc2MDgzMjAwMA&ptn=3&ver=2&hsh=4&fclid=16511d7b-5c5d-6902-36d6-0bf15d576874&u=a1aHR0cHM6Ly93d3cuYnJpdGFubmljYS5jb20vcGxhY2UvTWVsYm91cm5l&ntb=1,6 days ago· Melbourne has a reputation for conservatism and financial soundness—attributes that have contributed to its growth and are revealed by the burgeoning skyline of the central city and …,Bing,Melbourne churches autism trained,2025-10-19T12:59:15.939248
13 things to know before going toMelbourne- Lonely Planet,https://www.bing.com/ck/a?!&&p=bd76ce9ea6aa1d31405f9cd193e3f6e31f0421dd91a3e39316a0a260e306b37fJmltdHM9MTc2MDgzMjAwMA&ptn=3&ver=2&hsh=4&fclid=16511d7b-5c5d-6902-36d6-0bf15d576874&u=a1aHR0cHM6Ly93d3cubG9uZWx5cGxhbmV0LmNvbS9hcnRpY2xlcy90aGluZ3MtdG8ta25vdy1iZWZvcmUtdHJhdmVsaW5nLXRvLW1lbGJvdXJuZQ&ntb=1,"Sep 3, 2025· From packing the right clothes to local etiquette and staying safe, get the most out of a trip to Melbourne with these top things to know and insider tips.",Bing,Melbourne churches autism trained,2025-10-19T12:59:15.939251
"TravelGuide to Melbourne, Victoria - Tourism Australia",https://www.bing.com/ck/a?!&&p=45c3eb0daa2f9fc884900c01087855e931fc2aed4daada23df6dc37b5b14b2ccJmltdHM9MTc2MDgzMjAwMA&ptn=3&ver=2&hsh=4&fclid=16511d7b-5c5d-6902-36d6-0bf15d576874&u=a1aHR0cHM6Ly93d3cuYXVzdHJhbGlhLmNvbS9lbi11cy9wbGFjZXMvbWVsYm91cm5lLWFuZC1zdXJyb3VuZHMvZ3VpZGUtdG8tbWVsYm91cm5lLmh0bWw&ntb=1,"2 days ago· Discover things to do in Melbourne and find out why Melbourne is one of the world’s most liveable cities with fine dining, art galleries, fashion and a packed sports calendar.",Bing,Melbourne churches autism trained,2025-10-19T12:59:15.939253
"Melbourne, Australia - visitmelbourne.com - Official travel and ...",https://www.bing.com/ck/a?!&&p=99dc41ba0dc67fe87fb732c181dbf7c94d960cd5c7ccc31aad1067089cf5d133JmltdHM9MTc2MDgzMjAwMA&ptn=3&ver=2&hsh=4&fclid=16511d7b-5c5d-6902-36d6-0bf15d576874&u=a1aHR0cHM6Ly93d3cudmlzaXRtZWxib3VybmUuY29tL2Vu&ntb=1,Pack up and go: discover some of Victoria's best short road trips from Melbourne for budget-savvy backpackers.,Bing,Melbourne churches autism trained,2025-10-19T12:59:15.939256
Visitor information | City ofMelbourne,https://www.bing.com/ck/a?!&&p=58ef9e41ca367c398f0f455bbd082e4e469c1854e8e7edb64dbfbcd3fa3e5de1JmltdHM9MTc2MDgzMjAwMA&ptn=3&ver=2&hsh=4&fclid=16511d7b-5c5d-6902-36d6-0bf15d576874&u=a1aHR0cHM6Ly93d3cubWVsYm91cm5lLnZpYy5nb3YuYXUvdmlzaXRvci1pbmZvcm1hdGlvbg&ntb=1,"Whether you're from halfway across the world or just a few hours away, visitors to the City of Melbourne are welcome. Learn more about Melbourne, discover what's on and use our visitor …",Bing,Melbourne churches autism trained,2025-10-19T12:59:15.939259
"Melbourne, Australia: All You Must Know Before You Go (2025 ...",https://www.bing.com/ck/a?!&&p=6528da5c8c17709ed2533a9f11fcebec41377e3f3d83643d84995122a7d1ee2bJmltdHM9MTc2MDgzMjAwMA&ptn=3&ver=2&hsh=4&fclid=16511d7b-5c5d-6902-36d6-0bf15d576874&u=a1aHR0cHM6Ly93d3cudHJpcGFkdmlzb3IuY29tL1RvdXJpc20tZzI1NTEwMC1NZWxib3VybmVfVmljdG9yaWEtVmFjYXRpb25zLmh0bWw&ntb=1,"Melbourne’s earned its spot as one of the great big cities of the world. It’s got it all: parks and nature, colorful neighborhoods, a hip food scene, and plenty of history. Sip flat whites in cozy …",Bing,Melbourne churches autism trained,2025-10-19T12:59:15.939261
"17 Things to Do inMelbourne, Australia for First-Timers - TripZilla",https://www.bing.com/ck/a?!&&p=5161eb817e46f23c3a2acd6d743c5cf93c86ceb9b906285086c28046dfeee54eJmltdHM9MTc2MDgzMjAwMA&ptn=3&ver=2&hsh=4&fclid=16511d7b-5c5d-6902-36d6-0bf15d576874&u=a1aHR0cHM6Ly93d3cudHJpcHppbGxhLmNvbS9iZXN0LXRoaW5ncy10by1kby1tZWxib3VybmUvMTQyNzQ0&ntb=1,"Jul 10, 2023· From free museum exhibitions to cruising down Yarra River, there are an array of things you can do in Melbourne on your first visit.",Bing,Melbourne churches autism trained,2025-10-19T12:59:15.939263
"30 Incredible Things to Do in Melbourne, Australia(By a Local!)",https://www.bing.com/ck/a?!&&p=f481eae931bb5185704de83696fac1f9e3879bc41c56d81809cd8b72dcfc2b47JmltdHM9MTc2MDgzMjAwMA&ptn=3&ver=2&hsh=4&fclid=16511d7b-5c5d-6902-36d6-0bf15d576874&u=a1aHR0cHM6Ly93d3cubmV2ZXJlbmRpbmdmb290c3RlcHMuY29tL3RoaW5ncy10by1kby1tZWxib3VybmUtYXVzdHJhbGlhLw&ntb=1,"Jan 28, 2025· Melbourne has tons to offer its visitors. You’ve got beautiful beaches, expansive parks, glistening skyscrapers, bustling markets, hipster bars, excellent coffee, world-class street …",Bing,Melbourne churches autism trained,2025-10-19T12:59:15.939266
"Ocoee, FL | Official Website",https://www.bing.com/ck/a?!&&p=ad651618a9ccc3f3900c551455c89f41ed55c1530f492b43145ea75048e78b2eJmltdHM9MTc2MDgzMjAwMA&ptn=3&ver=2&hsh=4&fclid=16511d7b-5c5d-6902-36d6-0bf15d576874&u=a1aHR0cHM6Ly9vY29lZS5vcmcv&ntb=1,"Under Florida law, e-mail addresses are public records. If you do not want your e-mail address released in response to a public records request, do not send electronic mail to this entity. …",Bing,Ocoee baptist church sensory room,2025-10-19T12:59:32.248674
"Departments|Ocoee, FL",https://www.bing.com/ck/a?!&&p=06b7d5901cff545c0d80cca047165db8b929fe91d8a784c570c99d44c027e29fJmltdHM9MTc2MDgzMjAwMA&ptn=3&ver=2&hsh=4&fclid=16511d7b-5c5d-6902-36d6-0bf15d576874&u=a1aHR0cHM6Ly9mbC1vY29lZS5jaXZpY3BsdXMuY29tLzEyMy9EZXBhcnRtZW50cw&ntb=1,"The Department of Public Works provides essential infrastructure maintenance services for the maximum safety, health, and welfare of the citizens of Ocoee and visitors; and to enhance the …",Bing,Ocoee baptist church sensory room,2025-10-19T12:59:32.248681
"Ocoee, Florida-Wikipedia",https://www.bing.com/ck/a?!&&p=34e345f13b849c3ebb92d9a6a952f06669329d01c21890db1e4237a125401956JmltdHM9MTc2MDgzMjAwMA&ptn=3&ver=2&hsh=4&fclid=16511d7b-5c5d-6902-36d6-0bf15d576874&u=a1aHR0cHM6Ly9lbi53aWtpcGVkaWEub3JnL3dpa2kvT2NvZWUsX0Zsb3JpZGE&ntb=1,"Ocoee (/ əˈkoʊ.i /) is a city in Orange County, Florida, United States. It is part of the Orlando–Kissimmee–Sanford, Florida Metropolitan Statistical Area. According to the 2020 US …",Bing,Ocoee baptist church sensory room,2025-10-19T12:59:32.248684
2025OcoeeMusic Festival,https://www.bing.com/ck/a?!&&p=096f4b50dae7e5d4bb5795e30508d98f9a806a88d329b4860aab22c60831710dJmltdHM9MTc2MDgzMjAwMA&ptn=3&ver=2&hsh=4&fclid=16511d7b-5c5d-6902-36d6-0bf15d576874&u=a1aHR0cHM6Ly9vY29lZW11c2ljZmVzdGl2YWwuY29tLw&ntb=1,"Sep 16, 2025· Join us for two days of free live music, food, vendors, and family fun at the annual Ocoee Music Festival in Bill Breeze Park.",Bing,Ocoee baptist church sensory room,2025-10-19T12:59:32.248687
Ocoee- Orange County Florida,https://www.bing.com/ck/a?!&&p=af9f4759b0b243c1b8b31a90c1f17732a7cbb3fb8af3ee51bd194b8c7dcf52f0JmltdHM9MTc2MDgzMjAwMA&ptn=3&ver=2&hsh=4&fclid=16511d7b-5c5d-6902-36d6-0bf15d576874&u=a1aHR0cHM6Ly93d3cub3JhbmdlY291bnR5ZmwubmV0L0JvYXJkb2ZDb21taXNzaW9uZXJzL0Rpc3RyaWN0MUNvbW1pc3Npb25lci9EaXN0cmljdDFDb21tdW5pdGllcy9PY29lZS5hc3B4&ntb=1,"Once a sleepy city founded after the Civil War by confederate soldiers and their families, Ocoee has grown into the third-largest city in Orange County. The settlement began when Dr. J. D. Starke …",Bing,Ocoee baptist church sensory room,2025-10-19T12:59:32.248689
Ocoee- West Orange Chamber,https://www.bing.com/ck/a?!&&p=790d2e08941fce0414537d0715195f0ccd5e4d7a28bcddbf66dddf48d47ffe50JmltdHM9MTc2MDgzMjAwMA&ptn=3&ver=2&hsh=4&fclid=16511d7b-5c5d-6902-36d6-0bf15d576874&u=a1aHR0cHM6Ly93b2NoYW1iZXIuY29tL2NvbW11bml0eS9vY29lZS8&ntb=1,"Just a short distance from metropolitan Orlando and Walt Disney World, Ocoee offers a family-oriented, hometown atmosphere, countless recreational, employment and educational …",Bing,Ocoee baptist church sensory room,2025-10-19T12:59:32.248692
"Top Things to Do inOcoee, Florida • Authentic Florida",https://www.bing.com/ck/a?!&&p=ad99938d68f8a9932a8370fc19757fe51a64e295cee86f921a73d65d1b3de430JmltdHM9MTc2MDgzMjAwMA&ptn=3&ver=2&hsh=4&fclid=16511d7b-5c5d-6902-36d6-0bf15d576874&u=a1aHR0cHM6Ly9hdXRoZW50aWNmbG9yaWRhLmNvbS9vY29lZS1mbG9yaWRhLw&ntb=1,"Mar 8, 2025· Explore the top things to do in Ocoee, Florida. Discover local charm and rich history not far from the Orlando theme parks.",Bing,Ocoee baptist church sensory room,2025-10-19T12:59:32.248694
"Ocoee, FL - Niche",https://www.bing.com/ck/a?!&&p=8a74dc51213b19ace0d2a2256148d824d1d2162ca3fa7b9b5b2d0bd6322cf5c3JmltdHM9MTc2MDgzMjAwMA&ptn=3&ver=2&hsh=4&fclid=16511d7b-5c5d-6902-36d6-0bf15d576874&u=a1aHR0cHM6Ly93d3cubmljaGUuY29tL3BsYWNlcy10by1saXZlL29jb2VlLW9yYW5nZS1mbC8_bXNvY2tpZD0xNjUxMWQ3YjVjNWQ2OTAyMzZkNjBiZjE1ZDU3Njg3NA&ntb=1,"Ocoee is an up-and-coming sort of town, soon to develop into something more like Winter Garden. It has beautiful parks and new additions being added to its downtown area, including Thursday …",Bing,Ocoee baptist church sensory room,2025-10-19T12:59:32.248696
Ocoeebreaks ground on law enforcement training facility,https://www.bing.com/ck/a?!&&p=bd59c886a7bdc21c676b1c4b9429afd6e11faea2c27ef499ad5b7eafe2540eaeJmltdHM9MTc2MDgzMjAwMA&ptn=3&ver=2&hsh=4&fclid=16511d7b-5c5d-6902-36d6-0bf15d576874&u=a1aHR0cHM6Ly93d3cub3Jhbmdlb2JzZXJ2ZXIuY29tL25ld3MvMjAyNS9vY3QvMTUvb2NvZWUtYnJlYWtzLWdyb3VuZC1vbi1sYXctZW5mb3JjZW1lbnQtdHJhaW5pbmctZmFjaWxpdHkv&ntb=1,4 days ago· The City of Ocoee Regional Law Enforcement Training Facility will meet Central Florida police departments’ growing need for a 24/7 training facility.,Bing,Ocoee baptist church sensory room,2025-10-19T12:59:32.248698
"Ocoee, FLMap & Directions -MapQuest",https://www.bing.com/ck/a?!&&p=6ecc7ec8b50a539edc7313f9343599e77c5265ab178df8b1e56ca0f1c230797fJmltdHM9MTc2MDgzMjAwMA&ptn=3&ver=2&hsh=4&fclid=16511d7b-5c5d-6902-36d6-0bf15d576874&u=a1aHR0cHM6Ly93d3cubWFwcXVlc3QuY29tL3VzL2Zsb3JpZGEvb2NvZWUtZmwtMjgyMDM5MTQz&ntb=1,"Get directions, maps, and traffic for Ocoee, FL. Check flight prices and hotel availability for your visit.",Bing,Ocoee baptist church sensory room,2025-10-19T12:59:32.248700
Wesleyan University | Home,https://www.bing.com/ck/a?!&&p=57c8e86e53a4b72ca331d2c29bb19068b9887fb078d498680853dea0c4a3a3d8JmltdHM9MTc2MDgzMjAwMA&ptn=3&ver=2&hsh=4&fclid=16511d7b-5c5d-6902-36d6-0bf15d576874&u=a1aHR0cHM6Ly93d3cud2VzbGV5YW4uZWR1Lw&ntb=1,"Founded in 1831, Wesleyan University is a leading liberal arts and sciences university located in the heart of Connecticut.",Bing,wesleyan church neurodiverse West Palm Beach,2025-10-19T12:59:57.890119
Academics at Wesleyan University,https://www.bing.com/ck/a?!&&p=ec4ced86ea18491fda113d1d6eb5cd5467f54b3e69c7c110528c7b09eb87eb02JmltdHM9MTc2MDgzMjAwMA&ptn=3&ver=2&hsh=4&fclid=16511d7b-5c5d-6902-36d6-0bf15d576874&u=a1aHR0cHM6Ly93d3cud2VzbGV5YW4uZWR1L2FjYWRlbWljcy9pbmRleC5odG1s&ntb=1,"Explore Wesleyan University’s rigorous and flexible academics, where interdisciplinary learning and hands-on research prepare students for lifelong success.",Bing,wesleyan church neurodiverse West Palm Beach,2025-10-19T12:59:57.890126
About Wesleyan University,https://www.bing.com/ck/a?!&&p=4bb4dfb46548c91a321d06d6f921f9d5a55437f498ab78c5a557dc335871a4a9JmltdHM9MTc2MDgzMjAwMA&ptn=3&ver=2&hsh=4&fclid=16511d7b-5c5d-6902-36d6-0bf15d576874&u=a1aHR0cHM6Ly93d3cud2VzbGV5YW4uZWR1L2Fib3V0Lw&ntb=1,"Discover how Wesleyan’s commitment to real-world impact, diverse perspectives, and collaborative learning creates a one-of-a-kind educational experience. Get a quick overview of Wesleyan facts …",Bing,wesleyan church neurodiverse West Palm Beach,2025-10-19T12:59:57.890129
Wesleyan University at a Glance,https://www.bing.com/ck/a?!&&p=81f985d72213190515446fc1020e07678649cdeafbe1065078e3122ff79d3f44JmltdHM9MTc2MDgzMjAwMA&ptn=3&ver=2&hsh=4&fclid=16511d7b-5c5d-6902-36d6-0bf15d576874&u=a1aHR0cHM6Ly93d3cud2VzbGV5YW4uZWR1L2Fib3V0L2F0LWEtZ2xhbmNlLmh0bWw&ntb=1,"Founded in 1831, Wesleyan University is a private, non-sectarian school of liberal arts and sciences. Nestled in the heart of the small city of Middletown, Connecticut, our diverse, energetic liberal …",Bing,wesleyan church neurodiverse West Palm Beach,2025-10-19T12:59:57.890131
Admission and Aid - Wesleyan University,https://www.bing.com/ck/a?!&&p=8cc3417a8b52a67f322d9799469625ef89d55f3f8d7f8f21cb3fa3d0b4f1c194JmltdHM9MTc2MDgzMjAwMA&ptn=3&ver=2&hsh=4&fclid=16511d7b-5c5d-6902-36d6-0bf15d576874&u=a1aHR0cHM6Ly93d3cud2VzbGV5YW4uZWR1L2FkbWlzc2lvbi8&ntb=1,"Learn about Wesleyan’s application process, financial aid options, and commitment to affordability for prospective students.",Bing,wesleyan church neurodiverse West Palm Beach,2025-10-19T12:59:57.890133
Life at Wesleyan University,https://www.bing.com/ck/a?!&&p=e19c5e422967ea37976dfb1401481d1ce7d90472348e2625a24173b5bed75ff2JmltdHM9MTc2MDgzMjAwMA&ptn=3&ver=2&hsh=4&fclid=16511d7b-5c5d-6902-36d6-0bf15d576874&u=a1aHR0cHM6Ly93d3cud2VzbGV5YW4uZWR1L2xpZmUv&ntb=1,"Experience life at Wesleyan University, where students thrive in a dynamic community with abundant resources and opportunities of all kinds.",Bing,wesleyan church neurodiverse West Palm Beach,2025-10-19T12:59:57.890135
Undergraduate Academics - Wesleyan University,https://www.bing.com/ck/a?!&&p=948f45d65000f583e177fb8935ca855b734f2e4033c9fa34c86a7830c4b11983JmltdHM9MTc2MDgzMjAwMA&ptn=3&ver=2&hsh=4&fclid=16511d7b-5c5d-6902-36d6-0bf15d576874&u=a1aHR0cHM6Ly93d3cud2VzbGV5YW4uZWR1L2FjYWRlbWljcy91bmRlcmdyYWR1YXRlLWFjYWRlbWljcy9pbmRleC5odG1s&ntb=1,"Discover Wesleyan’s undergraduate programs, offering a dynamic liberal arts education with small classes, faculty mentorship, and research opportunities.",Bing,wesleyan church neurodiverse West Palm Beach,2025-10-19T12:59:57.890137
Our Open Curriculum | Academics - Wesleyan University,https://www.bing.com/ck/a?!&&p=76ea79c7325eb4fe11a03c7c1d96d61224b69f652755fd437560b5f5697849e7JmltdHM9MTc2MDgzMjAwMA&ptn=3&ver=2&hsh=4&fclid=16511d7b-5c5d-6902-36d6-0bf15d576874&u=a1aHR0cHM6Ly93d3cud2VzbGV5YW4uZWR1L2FjYWRlbWljcy91bmRlcmdyYWR1YXRlLWFjYWRlbWljcy9vcGVuLWN1cnJpY3VsdW0vaW5kZXguaHRtbA&ntb=1,Wesleyan stands apart from other institutions of higher education by empowering you to take ownership of your academic journey. Our courses emphasize active engagement and the …,Bing,wesleyan church neurodiverse West Palm Beach,2025-10-19T12:59:57.890141
Wesleyan’s Curriculum - Wesleyan University,https://www.bing.com/ck/a?!&&p=87a7c8846fa83d2f172dcb3df3ad3247ea9a7fd60457f804ed07a9d7568ec363JmltdHM9MTc2MDgzMjAwMA&ptn=3&ver=2&hsh=4&fclid=16511d7b-5c5d-6902-36d6-0bf15d576874&u=a1aHR0cHM6Ly9jYXRhbG9nLndlc2xleWFuLmVkdS9jdXJyaWN1bHVtLw&ntb=1,"At Wesleyan, students have the opportunity to work at the highest levels, discover what they love to do, and apply their knowledge in ways the world finds meaningful.",Bing,wesleyan church neurodiverse West Palm Beach,2025-10-19T12:59:57.890143
First Year Applicants - Wesleyan University,https://www.bing.com/ck/a?!&&p=6f7521bc7d24dba4c2058058be95343e04aaeaed1e69d448c0fe298caa028b49JmltdHM9MTc2MDgzMjAwMA&ptn=3&ver=2&hsh=4&fclid=16511d7b-5c5d-6902-36d6-0bf15d576874&u=a1aHR0cHM6Ly93d3cud2VzbGV5YW4uZWR1L2FkbWlzc2lvbi91bmRlcmdyYWR1YXRlLWFkbWlzc2lvbi9maXJzdC15ZWFyLmh0bWw&ntb=1,"Find everything you need to apply as a first-year student at Wesleyan, including requirements, deadlines, and resources.",Bing,wesleyan church neurodiverse West Palm Beach,2025-10-19T12:59:57.890145
Wellington- Main,https://www.bing.com/ck/a?!&&p=c28402b3503dce0be9e3d6b0c917679c0094995b5930ca05aabcbe3f12c4d630JmltdHM9MTc2MDgzMjAwMA&ptn=3&ver=2&hsh=4&fclid=16511d7b-5c5d-6902-36d6-0bf15d576874&u=a1aHR0cHM6Ly93d3cud2VsbGluZ3Rvbmluc2dyb3VwLmNvbS8&ntb=1,Find a local agent to learn more about how Wellington can service your insurance needs. Wellington Insurance Group is a Texas-based risk distribution and financial services organization …,Bing,Wellington evangelical church dimmed lights,2025-10-19T13:00:14.018416
Wellington- Wikipedia,https://www.bing.com/ck/a?!&&p=5236d8119cc59cddcea73ceb796d311860ea794bc4b00568053938df98a06198JmltdHM9MTc2MDgzMjAwMA&ptn=3&ver=2&hsh=4&fclid=16511d7b-5c5d-6902-36d6-0bf15d576874&u=a1aHR0cHM6Ly9lbi53aWtpcGVkaWEub3JnL3dpa2kvV2VsbGluZ3Rvbg&ntb=1,"Wellington is the capital city of New Zealand. It is located at the south-western tip of the North Island, between Cook Strait and the Remutaka Range. Wellington is the third-larg",Bing,Wellington evangelical church dimmed lights,2025-10-19T13:00:14.018425
"Wellington| New Zealand, Map, Population, & Facts | Britannica",https://www.bing.com/ck/a?!&&p=b47e45a2eaede98300ae9fcccfbb42903d77ed276b7a9f9ed0b9c860c1c24338JmltdHM9MTc2MDgzMjAwMA&ptn=3&ver=2&hsh=4&fclid=16511d7b-5c5d-6902-36d6-0bf15d576874&u=a1aHR0cHM6Ly93d3cuYnJpdGFubmljYS5jb20vcGxhY2UvV2VsbGluZ3Rvbi1OZXctWmVhbGFuZA&ntb=1,"Oct 9, 2025· Wellington, capital city, port, and major commercial centre of New Zealand, located in the extreme south of North Island. It lies on the shores and hills surrounding Wellington Harbour …",Bing,Wellington evangelical church dimmed lights,2025-10-19T13:00:14.018428
Top 10things to do in Wellington| 100% Pure New Zealand,https://www.bing.com/ck/a?!&&p=c9d0337a1b75e16104a40848a85c1b63b6136641fcc03823714c6d5112b96aaaJmltdHM9MTc2MDgzMjAwMA&ptn=3&ver=2&hsh=4&fclid=16511d7b-5c5d-6902-36d6-0bf15d576874&u=a1aHR0cHM6Ly93d3cubmV3emVhbGFuZC5jb20vbnovZmVhdHVyZS90ZW4tdW5taXNzYWJsZS1leHBlcmllbmNlcy1pbi13ZWxsaW5ndG9uLw&ntb=1,"Labelled the world's ‘coolest little capital’ by Lonely Planet, Wellington is renowned for its vibrant creative culture. Here are the city's top 10 must-dos.",Bing,Wellington evangelical church dimmed lights,2025-10-19T13:00:14.018430
VisitWellington- WellingtonNZ,https://www.bing.com/ck/a?!&&p=5db9edc005288d2579e817b3eb904a11bf63a2c8b839968b1c0b472b5ac3cff7JmltdHM9MTc2MDgzMjAwMA&ptn=3&ver=2&hsh=4&fclid=16511d7b-5c5d-6902-36d6-0bf15d576874&u=a1aHR0cHM6Ly93d3cud2VsbGluZ3Rvbm56LmNvbS8&ntb=1,"Experience the stories of Wellington and its people. From maritime history, early Māori settlement, and the city’s evolution since becoming the capital in 1865.",Bing,Wellington evangelical church dimmed lights,2025-10-19T13:00:14.018432
25 BestThings to Do in Wellington: TheWellingtonMust-Dos!,https://www.bing.com/ck/a?!&&p=a7ec992b891ba271be8b7e8c58214353f1777765d172aff67d5a6f2148a38a01JmltdHM9MTc2MDgzMjAwMA&ptn=3&ver=2&hsh=4&fclid=16511d7b-5c5d-6902-36d6-0bf15d576874&u=a1aHR0cHM6Ly9uenBvY2tldGd1aWRlLmNvbS8yMC1pbmNyZWRpYmxlLXRoaW5ncy10by1kby1pbi13ZWxsaW5ndG9uLw&ntb=1,"Jul 30, 2025· Get inspiration for attractions, activities and must-dos in Wellington with this list of the best things to do in Wellington, New Zealand.",Bing,Wellington evangelical church dimmed lights,2025-10-19T13:00:14.018435
"Wellington, FL | Official Website",https://www.bing.com/ck/a?!&&p=2bc1fca0278408ffe4f7d49c39539cfdf05a4783aab7a8307eda4e609e86f5a6JmltdHM9MTc2MDgzMjAwMA&ptn=3&ver=2&hsh=4&fclid=16511d7b-5c5d-6902-36d6-0bf15d576874&u=a1aHR0cHM6Ly93d3cud2VsbGluZ3RvbmZsLmdvdi8&ntb=1,Learn the rules & responsibilities of riding electric devices like e-bikes. Learn about grant programs available to Wellington residents.,Bing,Wellington evangelical church dimmed lights,2025-10-19T13:00:14.018437
www.wellington.org,https://www.bing.com/ck/a?!&&p=c1fd6e0f6b86fdd415bc32e25abb36974511e267d0f8a90a15ce2d789eb54487JmltdHM9MTc2MDgzMjAwMA&ptn=3&ver=2&hsh=4&fclid=16511d7b-5c5d-6902-36d6-0bf15d576874&u=a1aHR0cHM6Ly93d3cud2VsbGluZ3Rvbi5vcmcvYm9sZGxlYXA&ntb=1,"Dear Wellington Community, Since Wellington’s founding in 1982, the world has evolved at an astounding pace. What has remained constant is our school’s belief that education c",Bing,Wellington evangelical church dimmed lights,2025-10-19T13:00:14.018439
Home -WellingtonDaily News,https://www.bing.com/ck/a?!&&p=00871f6a09550cce1c25357f26bdaff2feb2a88897d51bce10e1beb960a77abaJmltdHM9MTc2MDgzMjAwMA&ptn=3&ver=2&hsh=4&fclid=16511d7b-5c5d-6902-36d6-0bf15d576874&u=a1aHR0cHM6Ly93d3cud2VsbGluZ3RvbmRhaWx5bmV3cy5jb20v&ntb=1,"Sumner-Cowley Electric Cooperative Donation Kids & Connections October 9, 2025 Young Explorers Discover Careers Downtown Last Thursday, staff at the Wellington Daily News …",Bing,Wellington evangelical church dimmed lights,2025-10-19T13:00:14.018441
"Wellington, New Zealand: All You Must Know Before You Go …",https://www.bing.com/ck/a?!&&p=d12d26fe56d0496a83be91ffad4ca91f27169a3769b4adb214d8be1eb4c1e42fJmltdHM9MTc2MDgzMjAwMA&ptn=3&ver=2&hsh=4&fclid=16511d7b-5c5d-6902-36d6-0bf15d576874&u=a1aHR0cHM6Ly93d3cudHJpcGFkdmlzb3IuY29tL1RvdXJpc20tZzI1NTExNS1XZWxsaW5ndG9uX0dyZWF0ZXJfV2VsbGluZ3Rvbl9Ob3J0aF9Jc2xhbmQtVmFjYXRpb25zLmh0bWw&ntb=1,"Wellington might be small, but it’s packed with personality. The New Zealand capital is known for its creative energy, stellar coffee, and diverse food scene—especially along vibrant Courtenay …",Bing,Wellington evangelical church dimmed lights,2025-10-19T13:00:14.018444
