title,url,snippet,source,search_query,search_timestamp
WORSHIPDefinition & Meaning -Merriam-Webster,https://www.bing.com/ck/a?!&&p=e16aab71416a1093132ce5bcb48b5727b9a766a19c284b40c5a33b8de63562fcJmltdHM9MTc2MDgzMjAwMA&ptn=3&ver=2&hsh=4&fclid=16511d7b-5c5d-6902-36d6-0bf15d576874&u=a1aHR0cHM6Ly93d3cubWVycmlhbS13ZWJzdGVyLmNvbS9kaWN0aW9uYXJ5L3dvcnNoaXA&ntb=1,The meaning of WORSHIP is to honor or show reverence for as a divine being or supernatural power. How to use worship in a sentence. Synonym Discussion of Worship.,Bing,worship center wheelchair accessible Aventura,2025-10-19T12:04:03.125169
What Exactly is WorshipAccording to the Bible? -Bible Study Tools,https://www.bing.com/ck/a?!&&p=987b20189c2901b46bad2f9db0f8ca046e6f3bf9109f97d180bfa22f91bbdfcaJmltdHM9MTc2MDgzMjAwMA&ptn=3&ver=2&hsh=4&fclid=16511d7b-5c5d-6902-36d6-0bf15d576874&u=a1aHR0cHM6Ly93d3cuYmlibGVzdHVkeXRvb2xzLmNvbS9iaWJsZS1zdHVkeS90b3BpY2FsLXN0dWRpZXMvd2hhdC1leGFjdGx5LWlzLXdvcnNoaXAuaHRtbA&ntb=1,"Mar 7, 2023· What Exactly is Worship According to the Bible? Worship can be defined as “the reverence or adoration that one shows toward something or someone; holding a person or object …",Bing,worship center wheelchair accessible Aventura,2025-10-19T12:04:03.125183
ChristianWorshipSongs 2024 - Praise andWorshipMusic,https://www.bing.com/ck/a?!&&p=00c354bc92fc8f618005dccebb81f12bf2ba3d95cdd9863ef034ba48dbfa3974JmltdHM9MTc2MDgzMjAwMA&ptn=3&ver=2&hsh=4&fclid=16511d7b-5c5d-6902-36d6-0bf15d576874&u=a1aHR0cHM6Ly93d3cueW91dHViZS5jb20vd2F0Y2g_dj1IRGJ1Y2h3R2Uycw&ntb=1,"This collection of praise and worship songs is perfect for personal devotion and group worship, blending contemporary Christian music with timeless Christian hymns.",Bing,worship center wheelchair accessible Aventura,2025-10-19T12:04:03.125188
WORSHIP| Englishmeaning- Cambridge Dictionary,https://www.bing.com/ck/a?!&&p=f58830a185a96668bd5987d55f35fb4e24ad7c5fb66a205a8e1d3ae05752c501JmltdHM9MTc2MDgzMjAwMA&ptn=3&ver=2&hsh=4&fclid=16511d7b-5c5d-6902-36d6-0bf15d576874&u=a1aHR0cHM6Ly9kaWN0aW9uYXJ5LmNhbWJyaWRnZS5vcmcvZGljdGlvbmFyeS9lbmdsaXNoL3dvcnNoaXA&ntb=1,WORSHIP definition: 1. to have or show a strong feeling of respect and admiration for God or a god: 2. to go to a…. Learn more.,Bing,worship center wheelchair accessible Aventura,2025-10-19T12:04:03.125191
What is the definition ofworship? -GotQuestions.org,https://www.bing.com/ck/a?!&&p=8e767fa4fd03cebed7722c8914865a23e1b7e8574c87be2eb3f2c13068be9610JmltdHM9MTc2MDgzMjAwMA&ptn=3&ver=2&hsh=4&fclid=16511d7b-5c5d-6902-36d6-0bf15d576874&u=a1aHR0cHM6Ly93d3cuZ290cXVlc3Rpb25zLm9yZy9kZWZpbml0aW9uLW9mLXdvcnNoaXAuaHRtbA&ntb=1,"Jun 7, 2024· A simplified definition of worship can be stated as a continual heart attitude of bowing down in reverence and humility before the supreme Lord and Creator of the universe. Worship is …",Bing,worship center wheelchair accessible Aventura,2025-10-19T12:04:03.125193
What IsWorship? -Desiring God,https://www.bing.com/ck/a?!&&p=88cafe19a4569d81324842488fcd8271d08db97d5f0d2a382165afb853972a6bJmltdHM9MTc2MDgzMjAwMA&ptn=3&ver=2&hsh=4&fclid=16511d7b-5c5d-6902-36d6-0bf15d576874&u=a1aHR0cHM6Ly93d3cuZGVzaXJpbmdnb2Qub3JnL2ludGVydmlld3Mvd2hhdC1pcy13b3JzaGlw&ntb=1,"Apr 29, 2016· We worship God authentically when we know him truly and treasure him duly. Then the word “worship” refers to that valuing, that inner valuing, becoming visible in the world in two …",Bing,worship center wheelchair accessible Aventura,2025-10-19T12:04:03.125196
What is the Biblical Meaning ofWorship: Understanding Its …,https://www.bing.com/ck/a?!&&p=57b4e825c880681d09e5a0f1ac87834ee4b04a4cae8bf46e263f94c86ab5bf37JmltdHM9MTc2MDgzMjAwMA&ptn=3&ver=2&hsh=4&fclid=16511d7b-5c5d-6902-36d6-0bf15d576874&u=a1aHR0cHM6Ly9iaWJsaWNhbGNocm9ub2xvZ3kuY29tL3doYXQtaXMtdGhlLWJpYmxpY2FsLW1lYW5pbmctb2Ytd29yc2hpcC8&ntb=1,"Apr 21, 2025· Discover the biblical meaning of worship in this insightful article that traces the evolution of worship from Old Testament rituals to New Testament intimacy with Christ. Explore …",Bing,worship center wheelchair accessible Aventura,2025-10-19T12:04:03.125199
What IsWorship- Meaning and Different Types |Crosswalk.com,https://www.bing.com/ck/a?!&&p=6425ba6eb036580c4d38582a43bf274fffda130f7b3e808eabdbeeb382d773b6JmltdHM9MTc2MDgzMjAwMA&ptn=3&ver=2&hsh=4&fclid=16511d7b-5c5d-6902-36d6-0bf15d576874&u=a1aHR0cHM6Ly93d3cuY3Jvc3N3YWxrLmNvbS9mYWl0aC9zcGlyaXR1YWwtbGlmZS93aGF0LWlzLXdvcnNoaXAtYW5kLXdoYXQtaXNudC1pdC5odG1s&ntb=1,"Oct 5, 2021· Could it be prayer? What is worship? Today we will look at Scripture and talk about how we can accurately define worship.",Bing,worship center wheelchair accessible Aventura,2025-10-19T12:04:03.125202
"Order ofworship— October 26, 2025 - The Presbyterian Outlook",https://www.bing.com/ck/a?!&&p=85863c74eec164982478fda5bc64a747ed9d92a5b068a51f7a317130047a7277JmltdHM9MTc2MDgzMjAwMA&ptn=3&ver=2&hsh=4&fclid=16511d7b-5c5d-6902-36d6-0bf15d576874&u=a1aHR0cHM6Ly9wcmVzLW91dGxvb2sub3JnLzIwMjUvMTAvb3JkZXItb2Ytd29yc2hpcC1vY3RvYmVyLTI2LTIwMjUv&ntb=1,"6 days ago· Order of worship — October 26, 2025 You are welcome to use this liturgy in your online worship services and distribute it to your congregation.",Bing,worship center wheelchair accessible Aventura,2025-10-19T12:04:03.125205
What Is Worship? - The Gospel Coalition,https://www.bing.com/ck/a?!&&p=733dee115b0601b21cc286877165b3c38fbac7efd6c4250d7f2cad562e6c4690JmltdHM9MTc2MDgzMjAwMA&ptn=3&ver=2&hsh=4&fclid=16511d7b-5c5d-6902-36d6-0bf15d576874&u=a1aHR0cHM6Ly93d3cudGhlZ29zcGVsY29hbGl0aW9uLm9yZy9hcnRpY2xlL3doYXQtaXMtd29yc2hpcC8&ntb=1,"Oct 11, 2013· Worship is not one segment of the Christian life among others. Worship is the entire Christian life, seen as a priestly offering to God. And when we meet together as a church, our …",Bing,worship center wheelchair accessible Aventura,2025-10-19T12:04:03.125207
Florida- Wikipedia,https://www.bing.com/ck/a?!&&p=13a7ae46007a77e8c641c6cf95c60096ae45c8db7aa8d9d8a4210a1dd3ad943aJmltdHM9MTc2MDgzMjAwMA&ptn=3&ver=2&hsh=4&fclid=16511d7b-5c5d-6902-36d6-0bf15d576874&u=a1aHR0cHM6Ly9lbi53aWtpcGVkaWEub3JnL3dpa2kvRmxvcmlkYQ&ntb=1,"Florida is world-renowned for its beach resorts, amusement parks, warm and sunny climate, and nautical recreation; attractions such as Walt Disney World, the Kennedy Space Center, and Miami …",Bing,Florida reformed church weighted blankets,2025-10-19T12:04:18.578254
"FloridaVacations, Travel & Tourism Guide | VISITFLORIDA",https://www.bing.com/ck/a?!&&p=454227c4386aa14bb45fdb03560f23b2e0529ff71f5005b76d34f260639ff4dcJmltdHM9MTc2MDgzMjAwMA&ptn=3&ver=2&hsh=4&fclid=16511d7b-5c5d-6902-36d6-0bf15d576874&u=a1aHR0cHM6Ly93d3cudmlzaXRmbG9yaWRhLmNvbS8&ntb=1,"Official state travel, tourism and vacation website for Florida, featuring maps, beaches, events, deals, photos, hotels, activities, attractions and other planning information.",Bing,Florida reformed church weighted blankets,2025-10-19T12:04:18.578262
MyFlorida.com - The Official Portal of the State ofFlorida,https://www.bing.com/ck/a?!&&p=779dc9d195642e8a66ecf25f69df13228037dab069fd275b583894786e4e15cdJmltdHM9MTc2MDgzMjAwMA&ptn=3&ver=2&hsh=4&fclid=16511d7b-5c5d-6902-36d6-0bf15d576874&u=a1aHR0cHM6Ly93d3cubXlmbG9yaWRhLmdvdi8&ntb=1,An online telephone and email directory for State Government agencies and employees in Florida.,Bing,Florida reformed church weighted blankets,2025-10-19T12:04:18.578266
"Florida| Map, Population, History, & Facts | Britannica",https://www.bing.com/ck/a?!&&p=802798f66aeed05716189f832da93492bcf578e1c5ce3a31539d2b0d11bbe9f5JmltdHM9MTc2MDgzMjAwMA&ptn=3&ver=2&hsh=4&fclid=16511d7b-5c5d-6902-36d6-0bf15d576874&u=a1aHR0cHM6Ly93d3cuYnJpdGFubmljYS5jb20vcGxhY2UvRmxvcmlkYQ&ntb=1,"5 days ago· Florida, constituent state of the United States of America. It was admitted as the 27th state in 1845. Florida is the most populous of the southeastern states and the second most …",Bing,Florida reformed church weighted blankets,2025-10-19T12:04:18.578269
30 BestThings to Do in FloridaFor an Epic Vacation - Time Out,https://www.bing.com/ck/a?!&&p=a6f45a86208afe5609dfa3d140eb24d654665e351e8de5328235fd3d636cf37eJmltdHM9MTc2MDgzMjAwMA&ptn=3&ver=2&hsh=4&fclid=16511d7b-5c5d-6902-36d6-0bf15d576874&u=a1aHR0cHM6Ly93d3cudGltZW91dC5jb20vdXNhL3RoaW5ncy10by1kby9iZXN0LXRoaW5ncy10by1kby1pbi1mbG9yaWRh&ntb=1,"Sep 22, 2025· The 30 best things to do in Florida From new theme parks and stunning beaches, to historic cities and cruises, these are the best things to do in Florida.",Bing,Florida reformed church weighted blankets,2025-10-19T12:04:18.578272
FloridaState Map | USA | Detailed Maps ofFlorida(FL),https://www.bing.com/ck/a?!&&p=21ed95cc5d02d7bcb5e17bd0bf9f952095f367883d6f625ef8dca9041ce97f64JmltdHM9MTc2MDgzMjAwMA&ptn=3&ver=2&hsh=4&fclid=16511d7b-5c5d-6902-36d6-0bf15d576874&u=a1aHR0cHM6Ly9vbnRoZXdvcmxkbWFwLmNvbS91c2Evc3RhdGUvZmxvcmlkYS8&ntb=1,"Description: This map shows states boundaries, islands, lakes, the state capital, counties, county seats, cities, towns and national parks in Florida.",Bing,Florida reformed church weighted blankets,2025-10-19T12:04:18.578274
Best Places to Visit in Floridafor 2025 - U.S. News Travel,https://www.bing.com/ck/a?!&&p=856ad25dda7b70c15249bb76e7128e798be1709714a58a5a87a4b8f8405fc16fJmltdHM9MTc2MDgzMjAwMA&ptn=3&ver=2&hsh=4&fclid=16511d7b-5c5d-6902-36d6-0bf15d576874&u=a1aHR0cHM6Ly90cmF2ZWwudXNuZXdzLmNvbS9yYW5raW5ncy9iZXN0LXBsYWNlcy10by12aXNpdC1pbi1mbG9yaWRhLw&ntb=1,"Apr 22, 2025· If the Sunshine State is calling but you're not sure where to go, we can help. We've ranked the best places to visit in Florida to help you plan your next vacation.",Bing,Florida reformed church weighted blankets,2025-10-19T12:04:18.578277
FloridaMaps & Facts - World Atlas,https://www.bing.com/ck/a?!&&p=b28a5e5a1bcf2c698f2b619b3a3da71a9d33d06f2446f64b4cb5c075ff0bd4adJmltdHM9MTc2MDgzMjAwMA&ptn=3&ver=2&hsh=4&fclid=16511d7b-5c5d-6902-36d6-0bf15d576874&u=a1aHR0cHM6Ly93d3cud29ybGRhdGxhcy5jb20vbWFwcy91bml0ZWQtc3RhdGVzL2Zsb3JpZGE&ntb=1,"Nov 27, 2024· Florida, nicknamed the Sunshine State, is a peninsula located in the Southeastern United States. It shares a border with both Alabama and Georgia in the North and is the only …",Bing,Florida reformed church weighted blankets,2025-10-19T12:04:18.578281
VisitFloridaUSA | What to Do inFloridaTourist Guide,https://www.bing.com/ck/a?!&&p=5c485563e5b13533a8bce6a7aedbaa34a3bab26ed5779b60336d1564128a3d17JmltdHM9MTc2MDgzMjAwMA&ptn=3&ver=2&hsh=4&fclid=16511d7b-5c5d-6902-36d6-0bf15d576874&u=a1aHR0cHM6Ly93d3cudmlzaXR0aGV1c2EuY29tL3N0YXRlL2Zsb3JpZGE&ntb=1,"Visit perennial Florida favorites such as beaches and theme parks – then go beyond them to discover natural treasures, first-rate cultural attractions and hidden gems.",Bing,Florida reformed church weighted blankets,2025-10-19T12:04:18.578284
19 Secret PlacesIn Florida That Only LocalsKnow - Southern Living,https://www.bing.com/ck/a?!&&p=b29b189312405e285ad37193473367bf9ceb77f58cc3878424e20ce7f153dec0JmltdHM9MTc2MDgzMjAwMA&ptn=3&ver=2&hsh=4&fclid=16511d7b-5c5d-6902-36d6-0bf15d576874&u=a1aHR0cHM6Ly93d3cuc291dGhlcm5saXZpbmcuY29tL3NlY3JldC1wbGFjZXMtaW4tZmxvcmlkYS04NzY1Njg3&ntb=1,"Sep 11, 2025· Forget following the crowds. From secret gardens to quirky restaurants to wildlife havens, here are 19 must-visit secret spots in Florida.",Bing,Florida reformed church weighted blankets,2025-10-19T12:04:18.578286
Sanford Health: Here for all. Here for good.,https://www.bing.com/ck/a?!&&p=a4507e917997ec7a1b9c26965ab5ad0a439e47e6ab726cd3a23c58ce33bdcb6bJmltdHM9MTc2MDgzMjAwMA&ptn=3&ver=2&hsh=4&fclid=16511d7b-5c5d-6902-36d6-0bf15d576874&u=a1aHR0cHM6Ly93d3cuc2FuZm9yZGhlYWx0aC5vcmcv&ntb=1,"Sanford Health, the largest rural health system in the United States, is dedicated to transforming the health care experience and providing access to world-class health care in America's heartland.",Bing,Sanford temple quiet worship,2025-10-19T12:04:36.218065
Find Doctors | Find Sanford Health Doctors Near You,https://www.bing.com/ck/a?!&&p=6169b7b3d7b747078cdda130ba0c02d569ed7506a3695e4f02a9ba95d258a366JmltdHM9MTc2MDgzMjAwMA&ptn=3&ver=2&hsh=4&fclid=16511d7b-5c5d-6902-36d6-0bf15d576874&u=a1aHR0cHM6Ly93d3cuc2FuZm9yZGhlYWx0aC5vcmcvZG9jdG9ycw&ntb=1,"Find a Doctor Sanford Health has more than 1,400 doctors to choose from to fit your every medical need. Use the options below to find the best doctor for you today. I'm Looking For...",Bing,Sanford temple quiet worship,2025-10-19T12:04:36.218071
"Sanford Clinic in Bismarck, ND",https://www.bing.com/ck/a?!&&p=6be9b895fe2c5bda2d8ebac9991136f56e736efd958688998508f8c40516e80eJmltdHM9MTc2MDgzMjAwMA&ptn=3&ver=2&hsh=4&fclid=16511d7b-5c5d-6902-36d6-0bf15d576874&u=a1aHR0cHM6Ly93d3cuc2FuZm9yZGhlYWx0aC5vcmcvbG9jYXRpb25zL3NhbmZvcmQtY2xpbmlj&ntb=1,"As a part of Sanford Health, Sanford Clinic is directly linked to a fully integrated health care system that includes the largest group of primary care doctors in the region, long-term care facilities, a …",Bing,Sanford temple quiet worship,2025-10-19T12:04:36.218073
"Sanford Moorhead Campus in Moorhead, MN - Sanford Health",https://www.bing.com/ck/a?!&&p=26cadd1f15815f840507dce7a92c42be89c58d68d7c35ae44e44600cee6040b7JmltdHM9MTc2MDgzMjAwMA&ptn=3&ver=2&hsh=4&fclid=16511d7b-5c5d-6902-36d6-0bf15d576874&u=a1aHR0cHM6Ly93d3cuc2FuZm9yZGhlYWx0aC5vcmcvbG9jYXRpb25zL3NhbmZvcmQtbW9vcmhlYWQtY2FtcHVz&ntb=1,"The Sanford Moorhead Campus offers primary and specialty care in one location. See us for family medicine, adult behavioral health services and women’s health care.",Bing,Sanford temple quiet worship,2025-10-19T12:04:36.218074
Find Locations | Find Sanford Health Locations Near You,https://www.bing.com/ck/a?!&&p=96a6ad5d950c1abba962a5c0efc19038f26c06f93527e1d7be9a7314074508e2JmltdHM9MTc2MDgzMjAwMA&ptn=3&ver=2&hsh=4&fclid=16511d7b-5c5d-6902-36d6-0bf15d576874&u=a1aHR0cHM6Ly93d3cuc2FuZm9yZGhlYWx0aC5vcmcvbG9jYXRpb25z&ntb=1,"It's easy to find a Sanford Health location. Search for your nearest clinic, urgent care, hospital, pharmacy, and other healthcare facility.",Bing,Sanford temple quiet worship,2025-10-19T12:04:36.218076
Contact Us - Sanford Health,https://www.bing.com/ck/a?!&&p=f6bbac3fffaad926e7601daf56149d242edd17b30dee7bcd8157203b85a0843dJmltdHM9MTc2MDgzMjAwMA&ptn=3&ver=2&hsh=4&fclid=16511d7b-5c5d-6902-36d6-0bf15d576874&u=a1aHR0cHM6Ly93d3cuc2FuZm9yZGhlYWx0aC5vcmcvY29udGFjdC11cw&ntb=1,"To schedule or reschedule an appointment or to message your provider, please call your Sanford provider or log in to My Sanford Chart. For all other needs, call using the numbers below or email …",Bing,Sanford temple quiet worship,2025-10-19T12:04:36.218077
Sanford Grand Forks Clinic,https://www.bing.com/ck/a?!&&p=1c5a0eb7f5350fdf5f85ddaff20190d192f7336a38072eb5cf64531e00f00c33JmltdHM9MTc2MDgzMjAwMA&ptn=3&ver=2&hsh=4&fclid=16511d7b-5c5d-6902-36d6-0bf15d576874&u=a1aHR0cHM6Ly93d3cuc2FuZm9yZGhlYWx0aC5vcmcvbG9jYXRpb25zL3NhbmZvcmQtZ3JhbmQtZm9ya3MtY2xpbmlj&ntb=1,"The Sanford Grand Forks Clinic offers walk-in care for urgent health needs in Grand Forks, North Dakota. Get seen today without an appointment.",Bing,Sanford temple quiet worship,2025-10-19T12:04:36.218079
Employee Resources - Sanford Health,https://www.bing.com/ck/a?!&&p=47bc8df2b26bbd7e1202c7ed18067fd6f81b0181868254739444fce59c08d69bJmltdHM9MTc2MDgzMjAwMA&ptn=3&ver=2&hsh=4&fclid=16511d7b-5c5d-6902-36d6-0bf15d576874&u=a1aHR0cHM6Ly93d3cuc2FuZm9yZGhlYWx0aC5vcmcvZW1wbG95ZWVzL3Jlc291cmNlcw&ntb=1,Stay up to date with news from Sanford Health Stay Connected About Medical Professionals Careers Video Library Sanford Health News Classes and Events Contact Media Relations Donate …,Bing,Sanford temple quiet worship,2025-10-19T12:04:36.218080
Sanford West Fargo Clinic,https://www.bing.com/ck/a?!&&p=7f9087d62eaa1b8eabfcea2fd616613e3066c28ebae84936db56ebbfb18bff89JmltdHM9MTc2MDgzMjAwMA&ptn=3&ver=2&hsh=4&fclid=16511d7b-5c5d-6902-36d6-0bf15d576874&u=a1aHR0cHM6Ly93d3cuc2FuZm9yZGhlYWx0aC5vcmcvbG9jYXRpb25zL3NhbmZvcmQtd2VzdC1mYXJnby1jbGluaWM&ntb=1,"Sanford West Fargo Clinic is a friendly, neighborhood clinic that has served the people of West Fargo for over 30 years. We offer behavioral health, pediatrics, primary care and women’s care …",Bing,Sanford temple quiet worship,2025-10-19T12:04:36.218081
"Sanford Broadway Medical Center in Fargo, ND",https://www.bing.com/ck/a?!&&p=a68251ebdd83611505562c2133f6df41da216bf3efadaf5dc4c9d2b6e0da1298JmltdHM9MTc2MDgzMjAwMA&ptn=3&ver=2&hsh=4&fclid=16511d7b-5c5d-6902-36d6-0bf15d576874&u=a1aHR0cHM6Ly93d3cuc2FuZm9yZGhlYWx0aC5vcmcvbG9jYXRpb25zL3NhbmZvcmQtYnJvYWR3YXktbWVkaWNhbC1jZW50ZXI&ntb=1,"Sanford Broadway Medical Center is a major medical center located in downtown Fargo, North Dakota that provides comprehensive, award-winning care for patients from across the Midwest.",Bing,Sanford temple quiet worship,2025-10-19T12:04:36.218083
"Clermont, FL | Official Website",https://www.bing.com/ck/a?!&&p=bff9dc6a0488460fb022eef89f5db8cb242854bac31c69d2a8055e908ef34c90JmltdHM9MTc2MDgzMjAwMA&ptn=3&ver=2&hsh=4&fclid=16511d7b-5c5d-6902-36d6-0bf15d576874&u=a1aHR0cHM6Ly93d3cuY2xlcm1vbnRmbC5nb3Yv&ntb=1,"Oct 12, 2025· The City of Clermont will be observing Independence day on Friday, July 4th, 2025. Read on...",Bing,Clermont episcopal church early service,2025-10-19T12:05:05.399777
"Clermont, Florida-Wikipedia",https://www.bing.com/ck/a?!&&p=ecf8cd088a49781cd86058fc67d17f583f519d5afc060e53ddd2511d0d40c7ebJmltdHM9MTc2MDgzMjAwMA&ptn=3&ver=2&hsh=4&fclid=16511d7b-5c5d-6902-36d6-0bf15d576874&u=a1aHR0cHM6Ly9lbi53aWtpcGVkaWEub3JnL3dpa2kvQ2xlcm1vbnQsX0Zsb3JpZGE&ntb=1,"Clermont is the most populous city in Lake County, within the U.S. state of Florida. The population was 43,021 in 2020. [11] It is about 22 miles (35 km) west of Orlando and 22 miles (35 km) …",Bing,Clermont episcopal church early service,2025-10-19T12:05:05.399791
TopThings to Do in Clermont,https://www.bing.com/ck/a?!&&p=fb65515b15f83ffbe17a05b7e7ddfb07783b0f4f89ee7d13a0e87002bc84d6a8JmltdHM9MTc2MDgzMjAwMA&ptn=3&ver=2&hsh=4&fclid=16511d7b-5c5d-6902-36d6-0bf15d576874&u=a1aHR0cHM6Ly93d3cudHJpcGFkdmlzb3IuY29tL0F0dHJhY3Rpb25zLWczNDE0Mi1BY3Rpdml0aWVzLUNsZXJtb250X0xha2VfQ291bnR5X0Zsb3JpZGEuaHRtbA&ntb=1,"Lakeridge Winery & Vineyards opened its doors in February 1989 in Clermont, Florida and sits on a 127-acre estate in gently rolling countryside some 25 miles west of downtown Orlando.",Bing,Clermont episcopal church early service,2025-10-19T12:05:05.399795
15 BestThings to Do in Clermont(FL) -The Crazy Tourist,https://www.bing.com/ck/a?!&&p=d4bd657e3d05eaaf1b51f4f7341eab0cc4be136858df29ecc718e01f5f408af8JmltdHM9MTc2MDgzMjAwMA&ptn=3&ver=2&hsh=4&fclid=16511d7b-5c5d-6902-36d6-0bf15d576874&u=a1aHR0cHM6Ly93d3cudGhlY3Jhenl0b3VyaXN0LmNvbS8xNS1iZXN0LXRoaW5ncy10by1kby1pbi1jbGVybW9udC1mbC8&ntb=1,"Aug 17, 2023· West of Orlando, the city of Clermont is in a hilly and water-rich part of Central Florida. Conditions around the city are just right for growing fruit, and for much of the 20th …",Bing,Clermont episcopal church early service,2025-10-19T12:05:05.399801
ClermontMain Street,https://www.bing.com/ck/a?!&&p=c0763d8462c7d138e64a3af3886bd4b4496bc4b3d31dca5e8e15e8d8376f8d39JmltdHM9MTc2MDgzMjAwMA&ptn=3&ver=2&hsh=4&fclid=16511d7b-5c5d-6902-36d6-0bf15d576874&u=a1aHR0cHM6Ly93d3cuY2xlcm1vbnRkb3dudG93bi5jb20v&ntb=1,"With miles of scenic lakefront, rich history, and a growing community of passionate locals and entrepreneurs, Clermont has all the ingredients for a thriving downtown.",Bing,Clermont episcopal church early service,2025-10-19T12:05:05.399807
ClermontFlorida - Vacation Planning & Attraction Guide,https://www.bing.com/ck/a?!&&p=2cabfeb707623d3ca387407c459bc0910cfc63388c1cfdbff5971595f360b0b3JmltdHM9MTc2MDgzMjAwMA&ptn=3&ver=2&hsh=4&fclid=16511d7b-5c5d-6902-36d6-0bf15d576874&u=a1aHR0cHM6Ly93d3cudmlzaXRmbG9yaWRhLmNvbS9wbGFjZXMtdG8tZ28vY2VudHJhbC9jbGVybW9udC8&ntb=1,"Just 35 minutes west of Orlando, the Lake County city of Clermont is the place to go for all kinds of outdoor adventures, family-friendly attractions, and a pedestrian- and bike-friendly downtown …",Bing,Clermont episcopal church early service,2025-10-19T12:05:05.399811
"13 Best Things To Do InClermont, Florida -Southern Living",https://www.bing.com/ck/a?!&&p=df288cba37e743ab712c2ee7a1ae20a1068208dbb13ff0364773dabd70bc6237JmltdHM9MTc2MDgzMjAwMA&ptn=3&ver=2&hsh=4&fclid=16511d7b-5c5d-6902-36d6-0bf15d576874&u=a1aHR0cHM6Ly93d3cuc291dGhlcm5saXZpbmcuY29tL2NsZXJtb250LWZsLTg2NTQ2NzE&ntb=1,"May 10, 2025· From picking your own fruit to cycling on miles of trails, Clermont has no shortage of fun. Here are the best things to do on your trip to Clermont, Florida.",Bing,Clermont episcopal church early service,2025-10-19T12:05:05.399815
OnlyinClermont |ClermontFlorida,https://www.bing.com/ck/a?!&&p=0576987948a1e4fb63ab2b1015f3eeadd6f2f0c48e3570a872f9b42466a1e322JmltdHM9MTc2MDgzMjAwMA&ptn=3&ver=2&hsh=4&fclid=16511d7b-5c5d-6902-36d6-0bf15d576874&u=a1aHR0cHM6Ly93d3cub25seWluY2xlcm1vbnQub3JnLw&ntb=1,"From hidden gems to family-friendly events, we help you find the best things to do in Clermont, Florida.",Bing,Clermont episcopal church early service,2025-10-19T12:05:05.399819
"16 Best Things to Do inClermont, FL – 2025 - Authentic Florida",https://www.bing.com/ck/a?!&&p=bb529f1392aa67e79c31f55c3d016e79f8b502bb87e81fa60cc1cf9044ec714fJmltdHM9MTc2MDgzMjAwMA&ptn=3&ver=2&hsh=4&fclid=16511d7b-5c5d-6902-36d6-0bf15d576874&u=a1aHR0cHM6Ly9hdXRoZW50aWNmbG9yaWRhLmNvbS90aGluZ3MtdG8tZG8taW4tY2xlcm1vbnQtZmwv&ntb=1,"Jun 4, 2025· Uncover amazing things to do in Clermont, Florida. Discover parks, eateries, and unique attractions in this laid back town.",Bing,Clermont episcopal church early service,2025-10-19T12:05:05.399822
Citrus Tower – Home - The Citrus Tower - Florida,https://www.bing.com/ck/a?!&&p=57df6f4262b6e9a71bfe60c94334b364d02929e47c872a445293aaf53c38badaJmltdHM9MTc2MDgzMjAwMA&ptn=3&ver=2&hsh=4&fclid=16511d7b-5c5d-6902-36d6-0bf15d576874&u=a1aHR0cHM6Ly9jaXRydXN0b3dlci5jb20v&ntb=1,"Located just on the outskirts of Orlando, Florida, you’ll find the thriving city of Clermont. This town just so happens to be the largest in Lake County—known for its rolling hills and pristine lakes. …",Bing,Clermont episcopal church early service,2025-10-19T12:05:05.399825
WORSHIPDefinition & Meaning -Merriam-Webster,https://www.bing.com/ck/a?!&&p=e16aab71416a1093132ce5bcb48b5727b9a766a19c284b40c5a33b8de63562fcJmltdHM9MTc2MDgzMjAwMA&ptn=3&ver=2&hsh=4&fclid=16511d7b-5c5d-6902-36d6-0bf15d576874&u=a1aHR0cHM6Ly93d3cubWVycmlhbS13ZWJzdGVyLmNvbS9kaWN0aW9uYXJ5L3dvcnNoaXA&ntb=1,The meaning of WORSHIP is to honor or show reverence for as a divine being or supernatural power. How to use worship in a sentence. Synonym Discussion of Worship.,Bing,worship center trained staff North Port,2025-10-19T12:05:25.231848
What Exactly is WorshipAccording to the Bible? -Bible Study Tools,https://www.bing.com/ck/a?!&&p=987b20189c2901b46bad2f9db0f8ca046e6f3bf9109f97d180bfa22f91bbdfcaJmltdHM9MTc2MDgzMjAwMA&ptn=3&ver=2&hsh=4&fclid=16511d7b-5c5d-6902-36d6-0bf15d576874&u=a1aHR0cHM6Ly93d3cuYmlibGVzdHVkeXRvb2xzLmNvbS9iaWJsZS1zdHVkeS90b3BpY2FsLXN0dWRpZXMvd2hhdC1leGFjdGx5LWlzLXdvcnNoaXAuaHRtbA&ntb=1,"Mar 7, 2023· What Exactly is Worship According to the Bible? Worship can be defined as “the reverence or adoration that one shows toward something or someone; holding a person or object …",Bing,worship center trained staff North Port,2025-10-19T12:05:25.231860
ChristianWorshipSongs 2024 - Praise andWorshipMusic,https://www.bing.com/ck/a?!&&p=00c354bc92fc8f618005dccebb81f12bf2ba3d95cdd9863ef034ba48dbfa3974JmltdHM9MTc2MDgzMjAwMA&ptn=3&ver=2&hsh=4&fclid=16511d7b-5c5d-6902-36d6-0bf15d576874&u=a1aHR0cHM6Ly93d3cueW91dHViZS5jb20vd2F0Y2g_dj1IRGJ1Y2h3R2Uycw&ntb=1,"This collection of praise and worship songs is perfect for personal devotion and group worship, blending contemporary Christian music with timeless Christian hymns.",Bing,worship center trained staff North Port,2025-10-19T12:05:25.231869
WORSHIP| Englishmeaning- Cambridge Dictionary,https://www.bing.com/ck/a?!&&p=f58830a185a96668bd5987d55f35fb4e24ad7c5fb66a205a8e1d3ae05752c501JmltdHM9MTc2MDgzMjAwMA&ptn=3&ver=2&hsh=4&fclid=16511d7b-5c5d-6902-36d6-0bf15d576874&u=a1aHR0cHM6Ly9kaWN0aW9uYXJ5LmNhbWJyaWRnZS5vcmcvZGljdGlvbmFyeS9lbmdsaXNoL3dvcnNoaXA&ntb=1,WORSHIP definition: 1. to have or show a strong feeling of respect and admiration for God or a god: 2. to go to a…. Learn more.,Bing,worship center trained staff North Port,2025-10-19T12:05:25.231873
What is the definition ofworship? -GotQuestions.org,https://www.bing.com/ck/a?!&&p=8e767fa4fd03cebed7722c8914865a23e1b7e8574c87be2eb3f2c13068be9610JmltdHM9MTc2MDgzMjAwMA&ptn=3&ver=2&hsh=4&fclid=16511d7b-5c5d-6902-36d6-0bf15d576874&u=a1aHR0cHM6Ly93d3cuZ290cXVlc3Rpb25zLm9yZy9kZWZpbml0aW9uLW9mLXdvcnNoaXAuaHRtbA&ntb=1,"Jun 7, 2024· A simplified definition of worship can be stated as a continual heart attitude of bowing down in reverence and humility before the supreme Lord and Creator of the universe. Worship is …",Bing,worship center trained staff North Port,2025-10-19T12:05:25.231876
What IsWorship? -Desiring God,https://www.bing.com/ck/a?!&&p=88cafe19a4569d81324842488fcd8271d08db97d5f0d2a382165afb853972a6bJmltdHM9MTc2MDgzMjAwMA&ptn=3&ver=2&hsh=4&fclid=16511d7b-5c5d-6902-36d6-0bf15d576874&u=a1aHR0cHM6Ly93d3cuZGVzaXJpbmdnb2Qub3JnL2ludGVydmlld3Mvd2hhdC1pcy13b3JzaGlw&ntb=1,"Apr 29, 2016· We worship God authentically when we know him truly and treasure him duly. Then the word “worship” refers to that valuing, that inner valuing, becoming visible in the world in two …",Bing,worship center trained staff North Port,2025-10-19T12:05:25.231879
